title,text,isAdvertisement,isLocalGuide,responseFromOwnerText,categoryName,likesCount,stars,spam_label,sentiment_label,id,url,rating,types
Great World,"Realized that recently there are many pet owners bringing in their pets even in the stroller entering the premises. Please do put more visible, obvious and huge signages other than those in the entrances of the mall. Do note that there are some pet especially those who are barking can scare the kids, some can even have serious allergy to the fur of the pets. Moreover, they are unhygienic especially when brought near the food stalls and supermarket. Lastly, there are some religions who are sensitive to these pets. This is so bad and not the first time that I saw pets inside this mall. Please do something about this before you lose your patrons.",False,True,,Shopping mall,0,1.0,not spam,bad,ChIJB14IQoMZ2jERyjiLXouuJe0,https://maps.google.com/?cid=17088256274737084618&g_mp=Cilnb29nbGUubWFwcy5wbGFjZXMudjEuUGxhY2VzLlNlYXJjaE5lYXJieRAAGAQgAA,4.3,"shopping_mall, point_of_interest, establishment"
Great World,"Stuck in the carpark for an hour now, and I am not close to getting out. This is because they closed all but one car park exit, but WITHOUT placing any signage prominently. Security and customer service refuse to do anything to help. Stuck in my position as per photo for 10 minutes now.",False,False,,Shopping mall,0,1.0,not spam,bad,ChIJB14IQoMZ2jERyjiLXouuJe0,https://maps.google.com/?cid=17088256274737084618&g_mp=Cilnb29nbGUubWFwcy5wbGFjZXMudjEuUGxhY2VzLlNlYXJjaE5lYXJieRAAGAQgAA,4.3,"shopping_mall, point_of_interest, establishment"
Chinatown Point,I am not happy with the cleaning of the toilets and the overall cleanliness of the mall..Also there is this tamil lady (enclosed photo) which keeps on fighting with customers. And hanging out with another Tamil lady for long time on the 3rd floor railing. All the cleaners should have some manners.,False,False,,Shopping mall,0,1.0,not spam,bad,ChIJBXC7TAsZ2jERdpAi-2uczMQ,https://maps.google.com/?cid=14180881314271629430&g_mp=Cilnb29nbGUubWFwcy5wbGFjZXMudjEuUGxhY2VzLlNlYXJjaE5lYXJieRAAGAQgAA,4.2,"shopping_mall, point_of_interest, establishment"
Chinatown Point,"This particular cleaning agency is really bad... The toilets are the worst cleaned and dust bins ae full  compared to any other mall in Singapore...Please get a good professional agency and replace this one.
See photo below of one of the cleaning guys sleeping below in the afternoon on one of the massage chairs.",False,False,,Shopping mall,0,1.0,not spam,bad,ChIJBXC7TAsZ2jERdpAi-2uczMQ,https://maps.google.com/?cid=14180881314271629430&g_mp=Cilnb29nbGUubWFwcy5wbGFjZXMudjEuUGxhY2VzLlNlYXJjaE5lYXJieRAAGAQgAA,4.2,"shopping_mall, point_of_interest, establishment"
Normanton Park,"Within less than 2 months, both of my road bikes got stolen, despite guards patrolling everyday. Really need to reconsider before settling down for its fancy pools!",False,True,,Apartment complex,0,1.0,not spam,bad,ChIJAUrVmI8b2jERdl2bYJXPrnA,https://maps.google.com/?cid=8119655418673454454&g_mp=Cilnb29nbGUubWFwcy5wbGFjZXMudjEuUGxhY2VzLlNlYXJjaE5lYXJieRAAGAQgAA,3.8,"apartment_complex, point_of_interest, establishment"
Normanton Park,The area is still relatively isolated compared to other condos in the area. The resident profiles are largely students from the universities which means sub leasing of rooms is quite common. The slightly cheaper rent is a compensating factor. It can get pretty noisy if your neighbours are students. Don’t be fooled by the outdoor facilities and landscaping.,False,True,,Apartment complex,0,1.0,not spam,bad,ChIJAUrVmI8b2jERdl2bYJXPrnA,https://maps.google.com/?cid=8119655418673454454&g_mp=Cilnb29nbGUubWFwcy5wbGFjZXMudjEuUGxhY2VzLlNlYXJjaE5lYXJieRAAGAQgAA,3.8,"apartment_complex, point_of_interest, establishment"
Keng Eng Kee Seafood @ Alexandra Village,"Food is mediocre and normal.
Crab is average only. 800g at $88

Service is ridiculously bad. As if I owe them a living. Rude and disrespectful.
Jia min, one of the female bosses is proud and rude. Not humble at all. Gave customer attitude.

Environment is hot and warm.

Do not recommend at all.
They do not deserve to represent Singapore in so many international music videos.",False,True,,Seafood restaurant,0,1.0,not spam,bad,ChIJu1Ef88sb2jER3Fc3W0QRoq8,https://maps.google.com/?cid=12655696888150317020&g_mp=Cilnb29nbGUubWFwcy5wbGFjZXMudjEuUGxhY2VzLlNlYXJjaE5lYXJieRAAGAQgAA,4.3,"seafood_restaurant, restaurant, food, point_of_interest, establishment"
Keng Eng Kee Seafood @ Alexandra Village,"Have always enjoyed the food and service. Often trying out new dishes that they recommend which had always been reasonably priced.

However, was taken back by the steep price of $38 for a small order of the seasoned cockles, which is about the same price as a whole roasted chicken.

Are you sure the price is correctly charged???",False,True,,Seafood restaurant,0,1.0,not spam,bad,ChIJu1Ef88sb2jER3Fc3W0QRoq8,https://maps.google.com/?cid=12655696888150317020&g_mp=Cilnb29nbGUubWFwcy5wbGFjZXMudjEuUGxhY2VzLlNlYXJjaE5lYXJieRAAGAQgAA,4.3,"seafood_restaurant, restaurant, food, point_of_interest, establishment"
Outram Park MRT Station (EW16),"No display of the exit no at many areas, especially when transit to other lines . Pretty bad design",False,True,,Railway services,0,1.0,not spam,bad,ChIJsXAyLJwZ2jERoLjZ8O1pN8I,https://maps.google.com/?cid=13994770837746071712&g_mp=Cilnb29nbGUubWFwcy5wbGFjZXMudjEuUGxhY2VzLlNlYXJjaE5lYXJieRAAGAQgAA,4.4,"point_of_interest, establishment"
Outram Park MRT Station (EW16),One of the worst mrt stations. The exits are so confusing no proper directions. Ended up walking around the mrt for a good 20 mins just to find the exit,False,True,,Railway services,0,1.0,not spam,bad,ChIJsXAyLJwZ2jERoLjZ8O1pN8I,https://maps.google.com/?cid=13994770837746071712&g_mp=Cilnb29nbGUubWFwcy5wbGFjZXMudjEuUGxhY2VzLlNlYXJjaE5lYXJieRAAGAQgAA,4.4,"point_of_interest, establishment"
Buddha Tooth Relic Temple,"It is a shame that information on the closure of certain storey were not display at the Entrance, I found a notice in the lift. (As at January 27, 2022)

Once in the building, other than not exposing one's knees, shoulders ( you will be provided with sarong n shawl to cover up), you will be asked to remove your hats and that include the ladies too (whilst in churches  ladies are expected to keep their hats on if they are wearing one) and also no taking photographs allow!

The museum on level 3 houses religious arts and scruptures   but you would not miss much if you give this place a miss.

As we are approaching Lunar New Year, there are more culture and interesting sights on the streets of Chinatown.",False,True,,Buddhist temple,0,1.0,not spam,bad,ChIJ0bwmznIZ2jEREOCMNggtIBk,https://maps.google.com/?cid=1810496563501129744&g_mp=Cilnb29nbGUubWFwcy5wbGFjZXMudjEuUGxhY2VzLlNlYXJjaE5lYXJieRAAGAQgAA,4.6,"place_of_worship, point_of_interest, establishment"
Buddha Tooth Relic Temple,The rudest and worst male security guards ever.  Unbefitting of Singapore and representative or horrendous hospitality here.   A country that is supposedly welcoming foreign business but yet there is blatant class and racial hierarchies that is representative of a backwards culture.,False,True,,Buddhist temple,0,1.0,not spam,bad,ChIJ0bwmznIZ2jEREOCMNggtIBk,https://maps.google.com/?cid=1810496563501129744&g_mp=Cilnb29nbGUubWFwcy5wbGFjZXMudjEuUGxhY2VzLlNlYXJjaE5lYXJieRAAGAQgAA,4.6,"place_of_worship, point_of_interest, establishment"
Momentus Hotel Alexandra,"I stayed at this so-called 5-star hotel and was shocked to find my room had no TV, no safe, and no peignoir (bathrobe). These are basic amenities you’d expect even from a 3-star hotel, let alone one that claims to be luxury.When you pay premium prices, you expect a certain level of comfort and service unfortunately, this hotel did not deliver. There was no explanation from the staff either. Very disappointing experience, and I would not recommend this hotel to anyone expecting true 5-star standards.Maybe because I were a black dude !!  I really don’t understand.",False,False,,Hotel,0,,not spam,bad,ChIJWzvWhoYb2jERkhHGbme6tmQ,https://maps.google.com/?cid=7257192802957005202&g_mp=Cilnb29nbGUubWFwcy5wbGFjZXMudjEuUGxhY2VzLlNlYXJjaE5lYXJieRAAGAQgAA,4.2,"hotel, lodging, point_of_interest, establishment"
Momentus Hotel Alexandra,"strongly advise anyone considering this hotel to think twice. My experience here was not only disappointing, but also deeply frustrating. Here’s why:
1.	Disregard for Booking Requests: Despite booking through a third-party platform a full month in advance and explicitly requesting a Queen-size bed in the order notes, we were told upon arrival that no such room was available. This kind of attitude is extremely inconsiderate, especially for travelers who specifically need either twin beds or a large bed due to personal or medical reasons.
2.	Unprofessional and Inconsistent Staff: The staff were cold and indifferent throughout our stay. Worse still, they gave us conflicting information. Our room key cards stopped working every single day, and depending on who you asked, the reason was either: (1) the card needs to be updated daily at the front desk, or (2) it became demagnetized because we put it near our phones (which we did not). It was like a bizarre guessing game—who do you believe? The lack of consistency and basic communication is appalling.
3.	No Accountability, No Compensation: This hotel does not care about your feedback or complaints. No matter what kind of poor service or treatment you receive, they will not allow cancellations or offer any compensation. This attitude adds a layer of stress and disappointment to what should be a relaxing vacation.
4.	Overpriced for What It Offers: The room was small, and the hotel is far from the city center. For the price we paid, we could have stayed somewhere with better service, better location, and—most importantly—basic respect for guests.

I spent my money and endured all this mistreatment, and since they refuse to refund or make things right, this is the only place I can express my frustration and warn others:
DO NOT BOOK THIS HOTEL.",False,False,,Hotel,0,1.0,not spam,bad,ChIJWzvWhoYb2jERkhHGbme6tmQ,https://maps.google.com/?cid=7257192802957005202&g_mp=Cilnb29nbGUubWFwcy5wbGFjZXMudjEuUGxhY2VzLlNlYXJjaE5lYXJieRAAGAQgAA,4.2,"hotel, lodging, point_of_interest, establishment"
Tiong Bahru Plaza,"sorry but the toilets here really need some proper maintenance, rest of the mall is fine but the toilets are just not up to par with cleanliness standards and upkeep",False,True,,Shopping mall,0,1.0,not spam,bad,ChIJe5qyMnkZ2jERYRN7QP_pCMQ,https://maps.google.com/?cid=14125797513755300705&g_mp=Cilnb29nbGUubWFwcy5wbGFjZXMudjEuUGxhY2VzLlNlYXJjaE5lYXJieRAAGAQgAA,4.2,"shopping_mall, point_of_interest, establishment"
Tiong Bahru Plaza,"The trampoline at the 3rd level playground was barrier for more than one years still not done the repairs work yet..

My son has been visiting for several times and feels very disappointed why not open it for so long… Because he loves to play trampoline. I believe other kids will be the same feeling too..

I really hope this feedback may raise the awareness to the management and expedite to complete the repair work…",False,True,,Shopping mall,0,1.0,not spam,bad,ChIJe5qyMnkZ2jERYRN7QP_pCMQ,https://maps.google.com/?cid=14125797513755300705&g_mp=Cilnb29nbGUubWFwcy5wbGFjZXMudjEuUGxhY2VzLlNlYXJjaE5lYXJieRAAGAQgAA,4.2,"shopping_mall, point_of_interest, establishment"
Chinatown MRT Station (DT19),"Confusing signage trying to get to down town line. Such a maze. small lanes, poor crowd control",False,False,,Transportation service,0,1.0,not spam,bad,ChIJsxht-eEZ2jER1cl3Egt3Na4,https://maps.google.com/?cid=12553070425803311573&g_mp=Cilnb29nbGUubWFwcy5wbGFjZXMudjEuUGxhY2VzLlNlYXJjaE5lYXJieRAAGAQgAA,4.5,"point_of_interest, establishment"
Chinatown MRT Station (DT19),"One of the worst toilets I have ever seen! Not well maintained and usually have spits, food remains and clogged toilets which were super disgusting! Not tourist friendly and may leave a bad impression on Chinatown’s image. The station also looked very old and dark (maybe due to paint fading), please renovate and refurbish for a better looking environment! Looks very boomer-ish",False,True,,Transportation service,0,1.0,not spam,bad,ChIJsxht-eEZ2jER1cl3Egt3Na4,https://maps.google.com/?cid=12553070425803311573&g_mp=Cilnb29nbGUubWFwcy5wbGFjZXMudjEuUGxhY2VzLlNlYXJjaE5lYXJieRAAGAQgAA,4.5,"point_of_interest, establishment"
Chinatown Complex,"I think the place needs to be better maintained or even renovated, especially the toilet. The food standard is not where it used to be, unlikely to revisit in the near future.",False,False,,Hawker center,0,1.0,not spam,bad,ChIJAenlH3MZ2jERqjoWXlxEH6w,https://maps.google.com/?cid=12402707062307830442&g_mp=Cilnb29nbGUubWFwcy5wbGFjZXMudjEuUGxhY2VzLlNlYXJjaE5lYXJieRAAGAQgAA,4.2,"restaurant, food, point_of_interest, establishment"
Chinatown Complex,"Was there looking for something interesting to eat.  Wanted to eat the Shong fish head cooked in HK style.  But realised there's really alot of stalls selling the same stuff so can't decide.  Later came across an interesting stall with photos enclosed.  Saw some interesting items in their menu like stir fry chinese wine chicken so decided to give it a try.  Least did I know it was a really really bad choice!!!

The end result item of the stir fry chinese wine chicken definitely looks totally different from what was shown on their overhead signboard.(please see the big bowl of soup in my photo of dishes on the serving tray as compared to the 2nd item on the overhead signboard).  At that point of time when I was at the stall ordering, it was manned by a young teenage girl who look to be less than 20yrs of age.  I ordered a total of 3 dishes with 2 rice for myself, namely a mixed fried and normal fish soup, a fermented beancurd vegetable and finally the chinese wine chicken.  To my surprise, everything was cooked served on the tray in about 10mins.

Firstly, both the rice were just half full.  It was dry and hard.  Secondly and to my surprise, the stir fry chinese wine chicken turned out to become a soup instead!  Its totally different from the photo!  And the taste was horrible.  The soup tasted bitter, oily and bland. I can only taste the bitterness, not even saltiness were present in the soup. Thirdly, the portion of the fish in the mixed fish soup was indeed pathetic!  The fried fish were a 1cm by 1cm fried fish and has a total of only 4 pieces in the soup.  There's also only a total of 3 slices of normal fish in the soup. Again, 3 small pieces of 1cm x 1cm of white beancurd and some dried  seaweed were found. But a compliment was a whole lot of white cabbage were given!  Still, its differently not worth the $5.50 price tag!  And lastly, I honestly find the fermented bean vegetable was to my liking at the very least.

To conclude, it was a very bad choice trying out the items in this stall!  So my advice, don't waste your hard earn money here!  Thanks",False,True,,Hawker center,0,1.0,not spam,bad,ChIJAenlH3MZ2jERqjoWXlxEH6w,https://maps.google.com/?cid=12402707062307830442&g_mp=Cilnb29nbGUubWFwcy5wbGFjZXMudjEuUGxhY2VzLlNlYXJjaE5lYXJieRAAGAQgAA,4.2,"restaurant, food, point_of_interest, establishment"
Tiong Bahru Market,"Sadly , so many hawkers have retired and no good ones to take over.
Many stalls have short hours and by lunchtime, are not operating. Dinner is even more pathetic.  A sad shadow of what it used to be . There is still the odd good stall , like the prawn noodles or the roast meats but the queues are overwhelming.",False,True,,Hawker center,0,1.0,not spam,bad,ChIJOU6y-HkZ2jERchOICIgjl0E,https://maps.google.com/?cid=4726285401114284914&g_mp=Cilnb29nbGUubWFwcy5wbGFjZXMudjEuUGxhY2VzLlNlYXJjaE5lYXJieRAAGAQgAA,4.3,"restaurant, food, point_of_interest, establishment"
Tiong Bahru Market,"Returned on 17 July 2025. Limited improvement to facilities despite months of renovation. Still as hot as ever. Kudos to the hawkers, who have kept up standards and generally maintained prices.",False,True,,Hawker center,0,1.0,not spam,good,ChIJOU6y-HkZ2jERchOICIgjl0E,https://maps.google.com/?cid=4726285401114284914&g_mp=Cilnb29nbGUubWFwcy5wbGFjZXMudjEuUGxhY2VzLlNlYXJjaE5lYXJieRAAGAQgAA,4.3,"restaurant, food, point_of_interest, establishment"
Grand Copthorne Waterfront Hotel Singapore,"Had a very bad experience while checking in the hotel. I messaged them on booking.com for early check in but they did not respond to message. Hence I called them from airport - on which they said they can’t find the booking. On reaching the hotel, Rausheen - refused to acknowledge booking. Took 2 hours to respond, did not look straight at me while speaking. Finally after multiple calls with booking.com, got a call from hotel saying they apologise for inconvenience and have found the booking. The room is ready and I can come check in. However, the ordeal didn’t end there. On the reception desk, Arif - demanded SGD50 for early check in. Told him I got a call from the hotel reservations team apologising for the situation and that for the inconvenience my room was now ready for check in. Took 20 mins to verify and when he could not, he threw the key on the desk, told me ‘I’m trusting you as an adult, hence I will give it to you free of charge. Hope you understand”. Made me feel like a scamster trying to benefit out of a situation. When asked if they could send the luggage to our room, he condescendingly pointed towards it and said you can carry it yourself. Arif did not make us feel welcome for our stay, nor did he bother to inform us about breakfast timings or restaurant details. If this is how you treat a customer after messing up their booking, you don’t deserve to be called a 5 star. Never staying here again!",False,False,"Dear Aditi,
Thank you for sharing your experience with us. We sincerely apologise for the inconvenience and frustration caused during your check-in process. This is certainly not the level of service we strive to provide, and we deeply regret that your stay began on such a disappointing note.
We take your feedback seriously and would like to investigate this matter further to ensure it does not happen again. Please contact us directly at gcw_enquiry@millenniumhotels.com.sg so that we can address your concerns promptly and assist you better.
We appreciate your understanding and hope to have the opportunity to restore your faith in our hotel.
Warm regards,
Herlin Leman 
Director of Rooms ",Hotel,0,1.0,not spam,bad,ChIJJwg-FJ0Z2jERu90t4MN7JeA,https://maps.google.com/?cid=16151451719844093371&g_mp=Cilnb29nbGUubWFwcy5wbGFjZXMudjEuUGxhY2VzLlNlYXJjaE5lYXJieRAAGAQgAA,4.3,"hotel, lodging, point_of_interest, establishment"
Grand Copthorne Waterfront Hotel Singapore,This Hotel deserves -5(negative) Rating. They are most Irresponsible people..I have stayed 3 Nights in the Hotel at Checking out they didn’t Release my Credit Card Hold Payment..Today it’s been 15 days I haven’t received my Payment Back. The most Worst part is They don’t reply to the Emails..I have been contacting them through mails But they don’t bother to reply me..This is totally Unprofessional Behaviour i have seen from any Hotel..,False,True,"Dear Mr. Verma,
Thank you for your feedback, and we’re truly sorry to hear about the inconvenience you’ve experienced regarding the credit card hold.
Please accept our sincere apologies for the delay and any frustration caused. Kindly send us your email address so that we can forward you the final bill, including the early check-in charges, and assist you in following up on the credit card pre-authorization release.
You may contact us directly at: enquiry.gcw@millenniumhotels.com
We genuinely appreciate your patience and look forward to resolving this matter promptly for you.
Warm regards,
Herlin Leman 
Director of Rooms",Hotel,0,1.0,not spam,bad,ChIJJwg-FJ0Z2jERu90t4MN7JeA,https://maps.google.com/?cid=16151451719844093371&g_mp=Cilnb29nbGUubWFwcy5wbGFjZXMudjEuUGxhY2VzLlNlYXJjaE5lYXJieRAAGAQgAA,4.3,"hotel, lodging, point_of_interest, establishment"
Furama RiverFront,"All of the rooms are dirty. The wood floors are coming up. The beds are horrible, very uncomfortable. It looks as if they only do handyman repairs. This hotel is in desperate need of remodeling. Also its a big hotel and the pool has 10 chairs. The food needs some serious improvements. From the outside front it looks run down. Truly the best thing about this hotel is the location.",False,True,"Hi HUBERT,

Thank you for taking the time to share your feedback. We’re truly sorry to hear that your experience did not meet expectations and that several aspects of your stay were disappointing.

Please be assured that we take your comments seriously. We are reviewing your concerns regarding room conditions, comfort, facilities, and food quality, and will be sharing them with our management team for further investigation and improvement.

On a positive note, we're glad to hear that our central location added some convenience to your visit. We hope to have the opportunity to provide you with a better experience in the future.

Warm regards,
Guest Engagement Team",Hotel,0,1.0,not spam,bad,ChIJzd9lsXcZ2jERXheJEyUMnpM,https://maps.google.com/?cid=10636952723276765022&g_mp=Cilnb29nbGUubWFwcy5wbGFjZXMudjEuUGxhY2VzLlNlYXJjaE5lYXJieRAAGAQgAA,4.2,"hotel, lodging, point_of_interest, establishment"
Furama RiverFront,"The hotel is in a good location thats near the bus and the train. However, the rooms are really old and I've found old stains on the bedding and on the shower curtains even after housekeeping. Would much rather spend the same amount of money for a better hotel. The 4 stars don't meet the expected level of standard",False,False,"Hello, Ryan!

Thank you for taking time to leave us a review about your recent stay with us. We have noted your feedback about the cleanliness of our hotel, and the other amenities we offer our guests. We are sincerely sorry about your frustrating experience and rest assured that we have taken your feedback very seriously as an opportunity for improvement. 
Our goal at Furama is to uphold the best standards and we apologize that this did not meet your expectations. I hope that we’ll have a chance again to serve you a better stay in the future.
Warm regards,
Mae Tan
Guest Engagement Manager
",Hotel,0,1.0,not spam,bad,ChIJzd9lsXcZ2jERXheJEyUMnpM,https://maps.google.com/?cid=10636952723276765022&g_mp=Cilnb29nbGUubWFwcy5wbGFjZXMudjEuUGxhY2VzLlNlYXJjaE5lYXJieRAAGAQgAA,4.2,"hotel, lodging, point_of_interest, establishment"
Hong Lim Market & Food Centre,I try to avoid eating at Hong Lim because of the low flying pigeons within the hawker centre. They crowd around the tray return area too. Don't need their saliva or poop to add flavor to my food. Food is getting quite expensive too. Might as well eat at an air-conditioned bird-free food court. Pigeons are the death of hawker culture.,False,True,,Hawker center,0,1.0,not spam,bad,ChIJRwKzawsZ2jERKxpszLl54EU,https://maps.google.com/?cid=5035158222305761835&g_mp=Cilnb29nbGUubWFwcy5wbGFjZXMudjEuUGxhY2VzLlNlYXJjaE5lYXJieRAAGAQgAA,4.3,"tourist_attraction, market, restaurant, food, point_of_interest, establishment"
Hong Lim Market & Food Centre,"Food tastes like medicine and smells like cockroaches, price pretty expensive for this place. pigeons all over the place.

Never coming back.",False,False,,Hawker center,0,1.0,not spam,bad,ChIJRwKzawsZ2jERKxpszLl54EU,https://maps.google.com/?cid=5035158222305761835&g_mp=Cilnb29nbGUubWFwcy5wbGFjZXMudjEuUGxhY2VzLlNlYXJjaE5lYXJieRAAGAQgAA,4.3,"tourist_attraction, market, restaurant, food, point_of_interest, establishment"
Tiong Bahru MRT Station (EW17),Lift no. 1 has not been cleaned since last year. There's a foul smell probably from urine. Disgusting.,False,True,,Railway services,0,1.0,not spam,bad,ChIJh5-QyX4Z2jER6AS12kg9wwM,https://maps.google.com/?cid=271127785688597736&g_mp=Cilnb29nbGUubWFwcy5wbGFjZXMudjEuUGxhY2VzLlNlYXJjaE5lYXJieRAAGAQgAA,4.3,"point_of_interest, establishment"
Tiong Bahru MRT Station (EW17),Crowded but tiong bahru plaza got some nice food,False,True,,Railway services,0,1.0,not spam,good,ChIJh5-QyX4Z2jER6AS12kg9wwM,https://maps.google.com/?cid=271127785688597736&g_mp=Cilnb29nbGUubWFwcy5wbGFjZXMudjEuUGxhY2VzLlNlYXJjaE5lYXJieRAAGAQgAA,4.3,"point_of_interest, establishment"
