title,text,isAdvertisement,isLocalGuide,responseFromOwnerText,categoryName,likesCount,stars,spam_label,sentiment_label,id,url,rating,types
Decathlon - Bedok,"It has now been several months since I initiated a return and refund request, and to date, I have received neither the refund nor any meaningful updates from your finance team.

This is, frankly, an utter embarrassment for a company of your size and reputation. A delay of this magnitude would be unacceptable for any retailer, let alone a multinational sporting brand. Each time I follow up, I’m met with silence or vague, repetitive responses. The lack of communication and accountability is deeply disappointing.

If your refund system genuinely takes this long, I suggest you update your Return Policy to reflect reality: “Refunds may take months, or even longer.” At this point, the experience borders on deceptive and feels like a scam, a disgusting reflection of customer service failure.

I expect a full refund immediately, along with a clear explanation of why this process has taken so long. This situation has already gone far beyond reasonable.",False,False,,Sporting goods store,0,1.0,not spam,bad,ChIJ37CzvJ4Z2jERYklcmCHmMUc,https://maps.google.com/?cid=5130134482516199778&g_mp=Cilnb29nbGUubWFwcy5wbGFjZXMudjEuUGxhY2VzLlNlYXJjaE5lYXJieRAAGAQgAA,4.7,"sporting_goods_store, bicycle_store, clothing_store, store, point_of_interest, establishment"
Decathlon - Bedok,Totally no cash payment. Kids went to buy things on their own. End up unable to buy. Parent have to make a trip down just to make payment. Totally Nonsense. Expect everyone to have a card to make payment.,False,False,,Sporting goods store,0,1.0,not spam,bad,ChIJ37CzvJ4Z2jERYklcmCHmMUc,https://maps.google.com/?cid=5130134482516199778&g_mp=Cilnb29nbGUubWFwcy5wbGFjZXMudjEuUGxhY2VzLlNlYXJjaE5lYXJieRAAGAQgAA,4.7,"sporting_goods_store, bicycle_store, clothing_store, store, point_of_interest, establishment"
Eunos MRT Station (EW7),Upkeep of station cleanliness seems to be deteriorating. There's more litter than usual and dead cockroaches lying around.,False,True,,Railway services,0,1.0,not spam,bad,ChIJ9RI97esZ2jER4IlsLkJ8EHc,https://maps.google.com/?cid=8579493913829345760&g_mp=Cilnb29nbGUubWFwcy5wbGFjZXMudjEuUGxhY2VzLlNlYXJjaE5lYXJieRAAGAQgAA,4.3,"point_of_interest, establishment"
Eunos MRT Station (EW7),Poor toilet maintenance with no hand soap,False,True,,Railway services,0,1.0,not spam,bad,ChIJ9RI97esZ2jER4IlsLkJ8EHc,https://maps.google.com/?cid=8579493913829345760&g_mp=Cilnb29nbGUubWFwcy5wbGFjZXMudjEuUGxhY2VzLlNlYXJjaE5lYXJieRAAGAQgAA,4.3,"point_of_interest, establishment"
JUMBO Seafood - East Coast,Strain of hair was found in the baby fried squids dish. My family and I also felt all the dishes (chili crab) was cooked too oily and unlike what I had experienced two days back. Restaurant duty manager only cancelled the billing and apologised.,False,True,We appreciate you taking the time to share such a detailed review about your recent experience. We are disheartened to hear about what happened. We would like to take the opportunity to speak with you further regarding your visit. Would you please reach out to us at feedback@jumbogroup.com.sg? We look forward to hearing from you. ,Seafood restaurant,0,1.0,not spam,bad,ChIJhYVqYZYi2jER9ddB0NENqJs,https://maps.google.com/?cid=11216230066759522293&g_mp=Cilnb29nbGUubWFwcy5wbGFjZXMudjEuUGxhY2VzLlNlYXJjaE5lYXJieRAAGAQgAA,4.2,"seafood_restaurant, restaurant, food, point_of_interest, establishment"
JUMBO Seafood - East Coast,"I am very disappointed with Jumbo Seafood at East Coast (I haven’t tried other branches, so I’m not sure if they taste the same).
I first had Dragon Chives in Malaysia, and it was incredibly delicious—tender and flavorful. When I saw it on Jumbo’s menu, I ordered it, but it turned out to be very tough and chewy, and the taste was not good at all.
As for the chili crab, I can easily make it at home—it’s simple and hard to mess up. However, Jumbo’s chili crab was just very mediocre, nothing special. The fried rice was also disappointing; any random eatery, or even the fried rice I cook at home, tastes better than Jumbo’s.
The bamboo clams were sold per piece, and we ordered four. The meat was tough, chewy, and not tasty at all.
Most importantly—the Australian lobster! It was cooked terribly! so bad that I have to use the word “inedible” to describe it! Australian lobster has great meat quality, but they managed to ruin it completely. What a waste of my lobster!
When seafood is fresh, simply boiling it would already make it delicious, but somehow, this famous seafood restaurant made it taste so bad!
Honestly, I don’t understand how such a well-known seafood restaurant can serve food that tastes worse than the zichar stall downstairs from my home.
The restaurant was very crowded, and the tables were packed closely together, so the dining environment was just average. The servers were busy, and when we were unsure of what flavors to order, they couldn’t provide much help.
All in all, I will never go to Jumbo again!",False,False,We appreciate you taking the time to share such a detailed review about your recent experience. We are disheartened to hear about what happened. We would like to take the opportunity to speak with you further regarding your visit. Would you please reach out to us at feedback@jumbogroup.com.sg? We look forward to hearing from you. ,Seafood restaurant,0,1.0,not spam,bad,ChIJhYVqYZYi2jER9ddB0NENqJs,https://maps.google.com/?cid=11216230066759522293&g_mp=Cilnb29nbGUubWFwcy5wbGFjZXMudjEuUGxhY2VzLlNlYXJjaE5lYXJieRAAGAQgAA,4.2,"seafood_restaurant, restaurant, food, point_of_interest, establishment"
Geylang Serai Market and Food Centre,"Completion of major upgrading works on the pathway in front of the Geylang Serai Market but so many designs flawed. No wheelchair ramps, bicycle barriers are a hindrance to the members of public trying to get past these barriers to make their way to the market, food centre. I can predict a bottle neck jam of people trying to get past these barriers. God forbid there's no human stampede one day at those installed bicycle barriers. Your contractor's design has failed big time!",False,True,,Hawker center,0,1.0,not spam,bad,ChIJ9YySoRAY2jERp62zayDnKuM,https://maps.google.com/?cid=16369149922063396263&g_mp=Cilnb29nbGUubWFwcy5wbGFjZXMudjEuUGxhY2VzLlNlYXJjaE5lYXJieRAAGAQgAA,4.3,"market, restaurant, food, point_of_interest, establishment"
Geylang Serai Market and Food Centre,"Enjoyed my experience in this underrated and unassumed gem of a place. Super, excellent food (nasi ayam bakar, the best prawn vadai, tapioca gandus, puti piring, Indian mee goreng) sedap, sedap, sedap. 5 star rating!!",False,False,,Hawker center,0,1.0,not spam,good,ChIJ9YySoRAY2jERp62zayDnKuM,https://maps.google.com/?cid=16369149922063396263&g_mp=Cilnb29nbGUubWFwcy5wbGFjZXMudjEuUGxhY2VzLlNlYXJjaE5lYXJieRAAGAQgAA,4.3,"market, restaurant, food, point_of_interest, establishment"
Kembangan MRT Station (EW6),Not vry good,False,False,,Railway services,0,1.0,not spam,bad,ChIJWZ9zphwZ2jERy7aV1a3TZP8,https://maps.google.com/?cid=18403066720908850891&g_mp=Cilnb29nbGUubWFwcy5wbGFjZXMudjEuUGxhY2VzLlNlYXJjaE5lYXJieRAAGAQgAA,4.4,"point_of_interest, establishment"
Kembangan MRT Station (EW6),kembangan MRT 附近有柑榜的气氛，过马路对面，有一间商店还充满人情味，老板娘不但年青而且招呼顧客非常用心，她和顾客打成一片，介绍我们买很多新产品，她还請了一位有年纪的妇女做收银员，她也是宝刀未老，不輸年青人，也是很可爱有人情味的人，店的旁边有一条路可以跑步和踏脚车，路的盡头有一餐馆，非常便宜又好吃，螃蟹米粉，药材鸡🐔和乾煎米粉(特色)还有很多，有空可以去走走,False,True,,Railway services,0,1.0,spam,good,ChIJWZ9zphwZ2jERy7aV1a3TZP8,https://maps.google.com/?cid=18403066720908850891&g_mp=Cilnb29nbGUubWFwcy5wbGFjZXMudjEuUGxhY2VzLlNlYXJjaE5lYXJieRAAGAQgAA,4.4,"point_of_interest, establishment"
Parkway East Hospital,"My daughter was sent for a stool test and due to insufficient stool sample, we were supposed to be refunded for one test. It has been 6 months despite numerous followups and redirecting of various departments and i still have not gotten back my refund! Not sure why is it so difficult for a simple request and makes me think twice to even go back for anything.",False,False,"Dear Clarissa Khoo,
Thank you for sharing your feedback. 
We understand your concerns regarding the matter of the refund. 
Your comments have been shared with the relevant team for their attention.
To assist further, could you please share additional details with us via the feedback link below? 
https://feedback.sg.ihhhealthcare.com/PEH
Thank you.",Hospital,0,1.0,not spam,bad,ChIJEdOXOg8Y2jERcyuHlOlWbfY,https://maps.google.com/?cid=17756944467010988915&g_mp=Cilnb29nbGUubWFwcy5wbGFjZXMudjEuUGxhY2VzLlNlYXJjaE5lYXJieRAAGAQgAA,3.3,"hospital, health, point_of_interest, establishment"
Parkway East Hospital,"Worst ever experience in the A&E department regarding the billing issue and make it so hard for a patient to left with no choice to walk out from the hospital and the dr and nurse need to run the drip faster and stop all the blood test .  Due to the PATIENT ACCOUNT OFFICE  can’t get hold of the insurance company to issue LOG and insist that without LOG need to go out and pay as outpatient . Reason being is tomorrow is public holiday ! Well done ! Awesome lady which scared the insurance company don’t want to make payment , and pushing the patient to go off as outpatient . She can just stand there and insist that cannot go for admission since the insurance company did not take the call for emergency LOG request . She can stand beside and just say how ? No LOG what is your  plan next , you wanna pay the full amount or you just stop treatment and pay as outpatient ? With no empathy at all!

Kudos to the patient account office staff name :
DEVI

You really did a good job ! By insisting that without LOG can’t do anything ! And make it like if u can’t pay just go off from the hospital ! Awesome attitude that you represent the hospital !

First time ever encounter this type of service and encounter such a situation.
Have no issue with other  hospital on insisting patient to sign and agree to pay if they can’t get the LOG . At least they won’t just say like that no choice and leave the patient with no choice to walk out and can’t complete the blood test .

Fair enough the dr and nurse is so nice to help me out in order to discharge faster !",False,True,"Dear JESSY TeOH,
Thank you for your feedback.
We understand the challenges you faced during your visit, particularly concerning the billing process and the urgency of your medical needs.
Your feedback has been escalated to the team for their review & our further improvement.
If you would like to discuss your experience further in details, please contact us via the following link: https://feedback.sg.ihhhealthcare.com/PEH.
Thank you.",Hospital,0,1.0,not spam,bad,ChIJEdOXOg8Y2jERcyuHlOlWbfY,https://maps.google.com/?cid=17756944467010988915&g_mp=Cilnb29nbGUubWFwcy5wbGFjZXMudjEuUGxhY2VzLlNlYXJjaE5lYXJieRAAGAQgAA,3.3,"hospital, health, point_of_interest, establishment"
Grand Mercure Singapore Roxy,"Disappointing stay. The study chair was dirty with food crumbs — I had to put a towel on it just to sit. The air duct made loud noises even when the aircon was off, and it got worse when turned on. I didn’t report it as I was prepping for an important meeting, but the sleepless night really affected me. Not the standard I expected from a Grand Mercure hotel.",False,True,"Dear R P,

Thank you for taking the time to share your feedback. We sincerely apologise for your experience with us and regret that we did not meet your expectations. Please rest assured that we are committed to providing excellent service and quality to all of our guests.

We are actively addressing the issue you encountered. Kindly contact us directly at H3610-FO16@accor.com so that we can assist you further.

Sincerely,
The Grand Mercure Singapore Roxy Team",Hotel,0,1.0,not spam,bad,ChIJhe37fXIY2jERBpZdIxltdm0,https://maps.google.com/?cid=7887611752120948230&g_mp=Cilnb29nbGUubWFwcy5wbGFjZXMudjEuUGxhY2VzLlNlYXJjaE5lYXJieRAAGAQgAA,4.3,"hotel, lodging, point_of_interest, establishment"
Grand Mercure Singapore Roxy,"Bedbugs. This hotel has bed bugs. Stay at your own risk.

We found a live one, caught it, and brought it to the hotel staff. Their reaction was honestly underwhelming. They claimed they will inform housekeeping to do an inspection but anyone who has dealt with bed bugs before knows that just cleaning in itself is woefully insufficient. After plenty of back and forth between the platform, the hotel, and us, they claimed they requested pest control inspection but were ultimately “unable” to share the proof of this inspection with us. I suppose to be fair I should mention they were kind enough to refund us one night’s stay (minus taxes and service fees that they deducted from the refund) out of five - how generous!

From their initial response to the way this eventually closed, I still have no confidence that they have the level of care for their guests needed to maintain a bed bug free hotel and certainly would never choose to or recommend anyone to stay here.",False,False,,Hotel,0,1.0,not spam,bad,ChIJhe37fXIY2jERBpZdIxltdm0,https://maps.google.com/?cid=7887611752120948230&g_mp=Cilnb29nbGUubWFwcy5wbGFjZXMudjEuUGxhY2VzLlNlYXJjaE5lYXJieRAAGAQgAA,4.3,"hotel, lodging, point_of_interest, establishment"
Sixth Avenue MRT Station (DT7),Where can I buy a drink?,False,True,,Railway services,0,1.0,not spam,bad,ChIJaxp43lUR2jER99f_hfP1Av8,https://maps.google.com/?cid=18375519855899039735&g_mp=Cilnb29nbGUubWFwcy5wbGFjZXMudjEuUGxhY2VzLlNlYXJjaE5lYXJieRAAGAQgAA,4.6,"point_of_interest, establishment"
Sixth Avenue MRT Station (DT7),고급 주택가가 밀집한 동네에 있는 역,False,True,,Railway services,0,3.0,spam,good,ChIJaxp43lUR2jER99f_hfP1Av8,https://maps.google.com/?cid=18375519855899039735&g_mp=Cilnb29nbGUubWFwcy5wbGFjZXMudjEuUGxhY2VzLlNlYXJjaE5lYXJieRAAGAQgAA,4.6,"point_of_interest, establishment"
Village Hotel Katong,"Rude, unprofessional reception staff member.

When my partner and I arrived at the hotel at around 4pm on Monday 18/8, we were greeted in an oddly offhand manner by a female receptionist who took around 10 mins assigning us a room, saying that none of the rooms had been cleaned yet.  We thought this was a bit strange, but we finally got assigned a room. However, when got to the room, we found that she had given us a twin room without telling us, even though we had booked a king room. When we went back to reception to question this, she rather rudely handed us off to another colleague without any apology for her actions at all.
The other receptionist thankfully had no trouble finding us a king room right away.. We were however, disappointed by the rude and unprofessional behaviour the original receptionist.",False,False,"Dear Baba David
Kamsiah (thank you) for taking the time to share your feedback. We sincerely apologize for the disappointing arrival experience you had with us. The behavior you described from our reception staff is unacceptable and does not reflect the standards we strive to uphold.
We are truly sorry for the delay, the room mix-up, and the lack of apology and courtesy you received. Please rest assured that we are addressing this issue with our team to ensure it does not happen again.
We appreciate you bringing this to our attention and hope you might consider giving us another chance to provide you with the high-quality service we are known for.
Best regards
Audrey",Hotel,0,1.0,not spam,bad,ChIJw7KGjXEY2jER0am68tliua4,https://maps.google.com/?cid=12590202921510676945&g_mp=Cilnb29nbGUubWFwcy5wbGFjZXMudjEuUGxhY2VzLlNlYXJjaE5lYXJieRAAGAQgAA,4.3,"hotel, lodging, point_of_interest, establishment"
Village Hotel Katong,"Carpark coupon did not work with 3 cars behind us, probably eager to leave as we were. We had to turn around and head back to the reception. This was obviously bloody inconvenient. He comes back mad saying that the coupon was a one-time use only and we had to pay S$14+.Pissed at this point, went in and asked for the duty manager.I thought nothing would shock me anymore but was told that the duty manager was in a meeting and if we needed to see the duty manager then we had to wait! Suddenly, the tables turned and she issues us a coupon. I am absolutely ashamed to have chosen this hotel as a gift for my his birthday and apologized all the way back home. Room was ok but bad service & Terrible breakfast. There are many hotels a stone's throw away if you choose this vicinity such Indigo, Holiday Inn, Grand Mercure or even Santa Grand. I haven't stayed in these properties but I doubt they'd be as horrific. Otherwise, PLENTY of options outside this vicinity within this price range! Try the breakfast at the Amara at Tanjong Pagar for example. That's what you call bang for your buck.
I wouldn't recommend this hotel to anyone. Good thing we did not pay an exorbitant price as we booked on Trip.com via Skyscanner for S$230 nett. Still, a complete waste of money and if you really value your time, it's time better spent elsewhere for people as busy as us.
Perhaps, the management should reconsider their hiring process, invest in a guest relations team but what use when the staff are so poorly trained.  WHAT A HORRIFYING DISSAPOINTMENT!",False,False,"Dear Swathi Raj
Kamsiah (thank you) for taking the time to share your experience with us. We’re truly sorry to hear that your recent stay did not meet your expectations, especially as it was meant to be a special occasion.
Please accept our sincere apologies for the inconvenience caused by the carpark coupon issue and the wait to speak with our duty manager. We understand how frustrating it must have been to be delayed at the exit, particularly with others waiting behind you. Please be assured that we will definitely find a better solution to handle the carpark situation.
We’re also very sorry that the service and breakfast did not meet your expectations. We will be reviewing your comment to our team to ensure that improvements are made.
While we’re glad to hear that the room was satisfactory, we regret that the overall experience fell far short. We will definitely go back to the drawing board to see how we can improve to ensure a better guest experience.
Once again,  we’re sorry that we didn’t deliver the experience you deserved and we hope that you would give us another opportunity in future to welcome you back.
Best regards
Audrey",Hotel,0,1.0,not spam,bad,ChIJw7KGjXEY2jER0am68tliua4,https://maps.google.com/?cid=12590202921510676945&g_mp=Cilnb29nbGUubWFwcy5wbGFjZXMudjEuUGxhY2VzLlNlYXJjaE5lYXJieRAAGAQgAA,4.3,"hotel, lodging, point_of_interest, establishment"
Joo Chiat Complex,"Toilets closes 1hr b4, arnd 8pm. Why?
And this is not the 1st time.
Facility management should take a closer look.",False,True,,Shopping mall,0,1.0,not spam,bad,ChIJlULslBAY2jERh1cJ-h8qH5Y,https://maps.google.com/?cid=10817411146794489735&g_mp=Cilnb29nbGUubWFwcy5wbGFjZXMudjEuUGxhY2VzLlNlYXJjaE5lYXJieRAAGAQgAA,4.2,"shopping_mall, point_of_interest, establishment"
Joo Chiat Complex,"Useless shops all run by lazy people...all closed by 7pm...wasted my time going there.
Lazy owners all running home to be with the family a d hooray2.
Krap place....",False,False,,Shopping mall,0,1.0,not spam,bad,ChIJlULslBAY2jERh1cJ-h8qH5Y,https://maps.google.com/?cid=10817411146794489735&g_mp=Cilnb29nbGUubWFwcy5wbGFjZXMudjEuUGxhY2VzLlNlYXJjaE5lYXJieRAAGAQgAA,4.2,"shopping_mall, point_of_interest, establishment"
Victoria Junior College,Worse inconsiderate school in the whole world. Conduct event on the weekend and make neighbourhoods life miserable. I was siting for University  exam at home and they were singing so loud. Called them to reduce noise no point.... just horrible horrible.. selfish school.......,False,False,,Junior college,0,1.0,not spam,bad,ChIJF_09TJ8i2jERuSvA4AMZtEQ,https://maps.google.com/?cid=4950609394833304505&g_mp=Cilnb29nbGUubWFwcy5wbGFjZXMudjEuUGxhY2VzLlNlYXJjaE5lYXJieRAAGAQgAA,4.4,"university, school, point_of_interest, establishment"
Victoria Junior College,"A few VJC ladies bullying my hyperactive child in study area and later deliberately waited for me at lift are after entrance and verbally abuse me with insults and shouting. After that I reported to the school with back view photo of one of student in uniform. But the VJC VP admin knowing student last paper has passed and said there is still private candidates and exams still ongoing for other students to not cause stress to them he won’t disturb them at this point and also he said due to PDPA he cannot let me see any photos to identify the students. In first place I don’t even need names or nric of students to be given, it’s just an excuse to me given by the VP. Also, the students no longer taking anymore exam, even if they are, I believe the. p has negative and wrong view that his approach to them will cause them stress because my intentions was they be involve in short session to counsel them and not reprimand them or so. I wouldn’t agree that stress is a factor since they can Attack child and mother during studying time. This is another way of telling me they can’t do anything. I have go all the way to seek help and my intention was to get a respectable teacher figure to counsel these students so that they won’t behave unreasonably in the society in the future with such Low morality in them. They probably not taught moral values in the school. And the school passive approach is a case of the bad leading the blind. Aren’t should not send their child just because the school is of good reputation in academic when the moral beliefs are low. They won’t grow to be useful person with such attitude and in this school.",False,True,,Junior college,0,1.0,not spam,bad,ChIJF_09TJ8i2jERuSvA4AMZtEQ,https://maps.google.com/?cid=4950609394833304505&g_mp=Cilnb29nbGUubWFwcy5wbGFjZXMudjEuUGxhY2VzLlNlYXJjaE5lYXJieRAAGAQgAA,4.4,"university, school, point_of_interest, establishment"
Keppel Club,"Responding to Keppel Club’s updated comment below.

Imagine you have paid the joining fees and monthly subscription fees, and the Club says ""Sorry you cannot book the tennis facility because we have leased it out to a tennis academy.""

Keppel Club has 2 tennis courts and have signed a multi-year contract to lease out the courts to Vamos Tennis Academy. The Club has blocked out peak hours for both courts on weekdays and weekends on their online booking website.

The response from Keppel Club is a clear misrepresentation. It is false that ""one of them is always available for members to book"". There is written documentation proof to back this up.

Importantly, Keppel Club has stated that the purpose is to ""build the tennis community through lessons, junior development and supporting club games"".

As a member, we should ask 5 key questions :

1. Why continue to charge us monthly fees if we are unable to use the club facilities?
2. Is it more profitable to lease out the tennis courts to a tennis academy?
3. Was there a transparent process on the selection of Vamos Tennis Academy?
4. How much is Keppel Club earning per month from this arrangement with Vamos?
5. Did the Club have to resort to this approach to increase its financials? What are we missing here?

Why stop at tennis? Why not lease out the golf course to a golf academy and might also boost its financial returns?

If we look at other club's approach, a similar club in the East has 3 tennis courts and have a tennis academy as well. But they have a clear policy that one tennis court will always be available to members to book. This could be a balanced approach that Keppel should be implementing and not falsely claiming it in their response.

I hope that Keppel Club will at least communicate with the members on this corporate action. It will be a bonus if the Club engages the members to share their views.",False,False,"It is not correct that Keppel Club does not allow members to book the tennis courts. The Club has two courts. One of them is always available for members to book. And if there is no class, the other courts will also be made available for members to book. The decision of having an academy, like in all clubs, is to help build the tennis community through lessons, junior development and supporting club games. Thank you for sharing your feedback. We appreciate your concerns and would love the opportunity to discuss your concerns in person or through our internal channels. We will reach out to you separately to discuss this matter further.",Country club,0,1.0,not spam,bad,ChIJ2QdCQegb2jERpeuye8JoFDw,https://maps.google.com/?cid=4329200326318156709&g_mp=Cilnb29nbGUubWFwcy5wbGFjZXMudjEuUGxhY2VzLlNlYXJjaE5lYXJieRAAGAQgAA,4.4,"tourist_attraction, golf_course, athletic_field, sports_club, sports_activity_location, restaurant, food, point_of_interest, establishment"
Keppel Club,very bad service and attitude in the Tee Top restaurant.  Highly recommend not eat in this restaurant. I don't understand how the management team training the team doing service for customers!,False,False,,Country club,0,1.0,not spam,bad,ChIJ2QdCQegb2jERpeuye8JoFDw,https://maps.google.com/?cid=4329200326318156709&g_mp=Cilnb29nbGUubWFwcy5wbGFjZXMudjEuUGxhY2VzLlNlYXJjaE5lYXJieRAAGAQgAA,4.4,"tourist_attraction, golf_course, athletic_field, sports_club, sports_activity_location, restaurant, food, point_of_interest, establishment"
