title,text,isAdvertisement,isLocalGuide,responseFromOwnerText,categoryName,likesCount,stars,spam_label,sentiment_label,id,url,rating,types
City Square Mall,"Sherman Kwek, CEO, CDL

Roy Chiang, CEO, CBM

CDL and CBM Management Teams

Dear Mr. Kwek, Mr. Chiang, and respective teams,

I am writing to express my extreme frustration and disappointment at the blatant and ongoing safety hazard under your management at City Square Mall ""City Square Mall is a family-friendly mall ""

Despite repeated feedback to CBM workers, nothing has been done about the recycle bins placed directly in front of the lift buttons, blocking access for children entirely. This is not a minor issue—it is a clear and unacceptable failure of safety and accessibility.

Here is the reality you continue to ignore:

Children who are alone cannot access the lift buttons at all. They cannot reach over or around the bins, leaving them stranded without adult help.

This is especially outrageous right now, as the opposite lift buttons have been out of order this month, leaving residents, visitors and especially children with no accessible alternative.

Fire risk: In an emergency, these bins create a direct obstruction. Delays in accessing lift controls during a fire or smoke event can be deadly, especially for children that cannot reach the lift call buttons. It is unconscionable that you are tolerating anything that hinders rapid evacuation.

Evacuation risk: Any child alone is effectively trapped, reliant on strangers or staff to move a bin or operate the lift—an utterly unacceptable situation in any modern, so-called “flagship” mall.

Universal access failure: This layout is discriminatory. It ignores not just children, but anyone with limited reach or mobility.

It is frankly absurd that CBM staff have been told about this multiple times and yet these bins remain in place. That is either gross incompetence or a clear statement that you simply do not care about the safety of your tenants and visitors.

City Square Mall is a CDL-branded property. Allowing this basic, glaring safety violation to continue is an embarrassment to your brand and a direct risk to your patrons.

I expect CDL and CBM to take IMMEDIATE, concrete action:

Remove or relocate the recycle bins so they do not obstruct any lift buttons—immediately.

Fix the out-of-order opposite lift buttons without delay.

Conduct a thorough audit of all lift lobbies in the mall for similar hazards.

Implement permanent guidelines to prevent this kind of dangerous, thoughtless placement in the future.

Your residents and visitors should not have to beg for the absolute minimum standard of safety. I am demanding a prompt and detailed response explaining exactly how you will correct this hazard—and when.

Btw I've been chasing CBM team for 2 nonths+",False,False,,Shopping mall,0,1.0,not spam,bad,ChIJZ1omp8gZ2jERgDUAb_hBKLY,https://maps.google.com/?cid=13125813649241290112&g_mp=Cilnb29nbGUubWFwcy5wbGFjZXMudjEuUGxhY2VzLlNlYXJjaE5lYXJieRAAGAQgAA,4.3,"shopping_mall, point_of_interest, establishment"
Pet Master Mega Store by CatSmart,"Totally not welcomed here. Totally ignored while other customer are being greeted and served. When a Caucasian come In , she is treated special. Total disappointed with this place.",False,False,"Hi Abang Nor Azhari,

Thank you for sharing your experience with us. At Pet Master, every pet parent deserves a warm welcome and exceptional service. We're truly sorry to hear you felt otherwise. We value every customer and strive to create an inclusive environment. We'd love to understand what went wrong and make it right. If you would like, you may reach us at hello@petmaster.com.sg.

Thank you again for sharing your experience — it matters, and we’ll do better.",Pet store,0,1.0,not spam,bad,ChIJnxU0wwkZ2jERYn6FCbMY0xU,https://maps.google.com/?cid=1572627852120391266&g_mp=Cilnb29nbGUubWFwcy5wbGFjZXMudjEuUGxhY2VzLlNlYXJjaE5lYXJieRAAGAQgAA,4.8,"pet_store, dog_cafe, store, point_of_interest, establishment"
Pet Master Mega Store by CatSmart,"Visited Pet Master Mega Store by CatSmart on 7 June 2025 with my sister and dog for the indoor pool and self-service shower. The experience was disappointing and unsafe.

The pool area was unclean—dusty floors, floating hairballs, and murky water. The only sink was broken, and there were no proper wash-up facilities for humans. Most concerning, my sister fell through rotted wood near the exit, resulting in a serious leg injury and infection. The structure was clearly not maintained.

We waited 15+ minutes for our booked shower room, then were moved to another that was left dirty, with clogged drains and dangerously hot equipment. While the manager refunded the $35 fee and apologised, that does not address the broader issues of hygiene, safety, and poor management.

Serious improvements are needed before I could recommend this place to others.",False,False,"Hi Vanessa, Thank you for bringing this to our attention. We're already actively addressing the concerns you've raised and working to improve our facilities. We apologize for the incident and are taking steps to prevent similar situations. Wishing your sister a speedy recovery. We'll continue to work behind the scenes to welcome you back in a better state soon.
",Pet store,0,1.0,not spam,bad,ChIJnxU0wwkZ2jERYn6FCbMY0xU,https://maps.google.com/?cid=1572627852120391266&g_mp=Cilnb29nbGUubWFwcy5wbGFjZXMudjEuUGxhY2VzLlNlYXJjaE5lYXJieRAAGAQgAA,4.8,"pet_store, dog_cafe, store, point_of_interest, establishment"
Hotel Boss,Positive: Didn't tell me they used a stolen card Negative: Check for stolen cards,False,False,,Hotel,0,1.0,not spam,bad,ChIJYakjWbYZ2jERgSiDZRBS8OY,https://maps.google.com/?cid=16640890853510031489&g_mp=Cilnb29nbGUubWFwcy5wbGFjZXMudjEuUGxhY2VzLlNlYXJjaE5lYXJieRAAGAQgAA,3.9,"hotel, lodging, point_of_interest, establishment"
Brewerkz East Coast Park,"I had high hopes for Brewerkz East Coast Park, given its nice atmosphere, but unfortunately, my experience was disappointing. While the ambiance is pleasant, the food was just okay. I specifically found the kids' meal to be not worth ordering; it was underwhelming and definitely not worth the wait. Speaking of wait, we ended up waiting an hour for our food to be served, which is far too long for a casual dining experience. Overall, I was left frustrated and won't be returning anytime soon.",False,False,,Restaurant,0,1.0,not spam,bad,ChIJQSh5L70Z2jER6kpGuWbFyCk,https://maps.google.com/?cid=3010873395882904298&g_mp=Cilnb29nbGUubWFwcy5wbGFjZXMudjEuUGxhY2VzLlNlYXJjaE5lYXJieRAAGAQgAA,4.7,"restaurant, asian_restaurant, liquor_store, bar, american_restaurant, event_venue, store, point_of_interest, food, establishment"
Brewerkz East Coast Park,"nice seaside.  beer is good！ no food recommend!!!!  feel totally disappointed. bb squid as said can't even imagine how tiny is n see and feel any seafood in this plate.  is out of my mind! first time i think i am eating what ? oil pieces?  about kids pasta meat ball  u can see,  all r 👎🏻. my daughter rejected  to come again.",False,False,"Dear Angie, 

We're sorry to hear that our menu items fall below your expectations. We greatly value your feedback and will convey it to our kitchen team to ensure they improve on our product offerings. We hope that you would give us another chance to change your opinion of Brewerkz and the experience at our East Coast Park outlet. 

Most sincerely, 
Brewerkz Group",Restaurant,0,1.0,not spam,bad,ChIJQSh5L70Z2jER6kpGuWbFyCk,https://maps.google.com/?cid=3010873395882904298&g_mp=Cilnb29nbGUubWFwcy5wbGFjZXMudjEuUGxhY2VzLlNlYXJjaE5lYXJieRAAGAQgAA,4.7,"restaurant, asian_restaurant, liquor_store, bar, american_restaurant, event_venue, store, point_of_interest, food, establishment"
Sultan Mosque,"As one of the only visible prayer place for Muslims around the world, it was a bit disappointing. There is no aircon (which I thought they will since its a staple place for Muslim tourists come- I thought Singapore is rich but still doesn't have the courtesy to level up their mosque (when there is not many mosque to begin with). But it was calm place to rest and pray. I just hope Singapore level up the mosque facilities to be par with their image of 'first world country'",False,True,,Mosque,0,1.0,not spam,bad,ChIJb6xq2bAZ2jERE1P6sVKtofw,https://maps.google.com/?cid=18204021739493151507&g_mp=Cilnb29nbGUubWFwcy5wbGFjZXMudjEuUGxhY2VzLlNlYXJjaE5lYXJieRAAGAQgAA,4.7,"mosque, tourist_attraction, place_of_worship, point_of_interest, establishment"
Sultan Mosque,"Considering Singapore is touted as being clean, this has to be one of the dirtiest places I had seen on my trip. Not sure if that's to do with the construction around the vicinity.
The footpaths down this way are uneven and could be a tripping hazard, to elderly tourists, cigarette  butts line the drainways, the roads are clogged with traffic and signage in the area not existent, and I encountered a very large man begging for $10 Singapore dollars. Had a hard time finding this place from Bugis market. The laneway adjacent provided the only color with brightly painted shop fronts but the non touting touters put me off.",False,True,,Mosque,0,1.0,not spam,bad,ChIJb6xq2bAZ2jERE1P6sVKtofw,https://maps.google.com/?cid=18204021739493151507&g_mp=Cilnb29nbGUubWFwcy5wbGFjZXMudjEuUGxhY2VzLlNlYXJjaE5lYXJieRAAGAQgAA,4.7,"mosque, tourist_attraction, place_of_worship, point_of_interest, establishment"
Aperia Mall,"Around 1pm went to 2nd floor toilet with upset of the attitude of the lady cleaning service lady height around 145 cm I believe from her action is not SIngaporean
Very rude attitude answering when asked for the handicap toilet green show but lock position.
Another incident which I
show her changing the ladies toilet  rolls which in stil usable into the. Dustbins 😓😥😰",False,True,,Shopping mall,0,1.0,not spam,bad,ChIJFx0yu8sZ2jERgoVtEwS7Igs,https://maps.google.com/?cid=802409309805577602&g_mp=Cilnb29nbGUubWFwcy5wbGFjZXMudjEuUGxhY2VzLlNlYXJjaE5lYXJieRAAGAQgAA,3.9,"shopping_mall, point_of_interest, establishment"
Aperia Mall,Most boring mall ever. Not much variety of food and drinks. Challenger moved out and it's the only saving grace of the place.,False,True,,Shopping mall,0,1.0,not spam,bad,ChIJFx0yu8sZ2jERgoVtEwS7Igs,https://maps.google.com/?cid=802409309805577602&g_mp=Cilnb29nbGUubWFwcy5wbGFjZXMudjEuUGxhY2VzLlNlYXJjaE5lYXJieRAAGAQgAA,3.9,"shopping_mall, point_of_interest, establishment"
Lavender MRT Station (EW11),"This station doesn't have air conditioning, so it's not crowded at all. Passengers hurry to leave the station after they arrived.",False,True,,Transportation service,0,1.0,not spam,bad,ChIJm34e8bUZ2jERrWo7aOBwxhk,https://maps.google.com/?cid=1857296005460617901&g_mp=Cilnb29nbGUubWFwcy5wbGFjZXMudjEuUGxhY2VzLlNlYXJjaE5lYXJieRAAGAQgAA,4.4,"point_of_interest, establishment"
Lavender MRT Station (EW11),"The 2 ladies at the ticket counter and the information desk were very rude and were not ready to share any information that can help tourists. Though I told her that I just want to use the MRT once and then I would be returning back to India, she issued me MRT cards of 10 SGD out of which 5 SGD was non refundable. She didn't even consider informing me of this before issuing the card (though tourists cards were available that would have been cheaper). Is this how the tourists should be treated?",False,True,,Transportation service,0,1.0,not spam,bad,ChIJm34e8bUZ2jERrWo7aOBwxhk,https://maps.google.com/?cid=1857296005460617901&g_mp=Cilnb29nbGUubWFwcy5wbGFjZXMudjEuUGxhY2VzLlNlYXJjaE5lYXJieRAAGAQgAA,4.4,"point_of_interest, establishment"
PS.Cafe Harding Road,"Made a reservation for 12 pax, no waiting time. Food was okay. Was super taken aback that the manager himself the service is super bad and rude. Requested to add chairs only and not table. We came in a big group of more than 10 pax and, we are seating at a corner, we don't mind to squeeze a little more with the tables that we have. The manager reply was no, cannot, your 2 extra friends will have to join the queue and wait outside.
The thing is, we have already placed our orders and we don't mind squeezing a little more. The manager is not helpful at all. is he expecting to have a table and seat after all of us finish eating and perhaps seated at another table far away from us? We already don't mind squeezing together in the same table.

Good thing is that we approach another server to request for the same 2 chairs. And the server is quick to react and resolved our issue by taking another 2 chair from the outdoor seating for us.

We are only requesting for small issue of adding chair. Why a normal server can do it but not the manager himself?

The drinks cups were also full of dirty scratches for my whole group of more than 10 pax. I think it's also time to have a change in the utensils.

Being a high end restaurant, I think it is honestly not suitable to use cups that's full scratches and stains. It just lower down the level and overall experience.

I think you can consider to send your manager to some training to help improve his service provided. He is the main host/greeter at the front, and his attitude will leave a not pleasant first impression to the customer. I understand that the business good. But telling us to let our 2 friend ls join the queue when we have a big group of more than 10, it is a little not appropriate as we are not asking for table which takes up space, we are only requesting for chairs/stools.",False,False,"Dear guest,

Thank you for your feedback and we’re sorry to hear that your experience fell short of expectations. Please be assured that our team always does its best to accommodate seating requests while maintaining safety and comfort for all guests. There was no intention to come across as rude, and we’re truly sorry if our communication gave that impression.

We’re also grateful for your comments regarding the condition of the glassware. We take such feedback seriously and will be reviewing this with our team to ensure our standards are upheld.

Thank you again for sharing your thoughts — your feedback helps us improve. We hope to have the opportunity to welcome you and your group back again.

Regards,
PS. Team",Cafe,0,1.0,not spam,bad,ChIJc4rrRyMa2jERC31T5xHBk0o,https://maps.google.com/?cid=5373851063022746891&g_mp=Cilnb29nbGUubWFwcy5wbGFjZXMudjEuUGxhY2VzLlNlYXJjaE5lYXJieRAAGAQgAA,4.4,"cafe, food, point_of_interest, establishment"
PS.Cafe Harding Road,"We came in front the side door, and the Manager told my wife: to stand at the side and wait for his team member to assign a table.

We asked if we could sit outside.
Team: we are closing the section outside.

We said it was really cold inside with the aircon and the fan.
Team: here is your seat.

Haven’t even started my meal, and the experience is absolutely terrible.

Besides the good food, I think PS Cafe is getting super sad with their service.

Gosh, your outdoor seating is still available, why aren’t you letting ppl sit outside?
Why do you speak with a tone like that?",False,True,"Dear guest,

Thank you for taking the time to share your feedback with us. We’re sorry to hear that your recent visit did not meet expectations.

We apologise for the inconvenience caused by the closure of the outdoor seating area during your visit. We appreciate your understanding, and we agree that the reason should have been communicated more clearly and with greater courtesy.

We’re sorry for the way the situation was handled, and we will be speaking with the team to reinforce the importance of clear communication and warm, respectful service at all times.

Thank you again for your feedback, and we hope to have the opportunity to welcome you back for a much improved experience.

Regards,
PS. Team",Cafe,0,1.0,not spam,bad,ChIJc4rrRyMa2jERC31T5xHBk0o,https://maps.google.com/?cid=5373851063022746891&g_mp=Cilnb29nbGUubWFwcy5wbGFjZXMudjEuUGxhY2VzLlNlYXJjaE5lYXJieRAAGAQgAA,4.4,"cafe, food, point_of_interest, establishment"
Elementum Parking,Parking charges,False,True,,Corporate office,0,1.0,not spam,bad,ChIJX0ZjawAb2jERNrvnhPFXemU,https://maps.google.com/?cid=7312253639817935670&g_mp=Cilnb29nbGUubWFwcy5wbGFjZXMudjEuUGxhY2VzLlNlYXJjaE5lYXJieRAAGAQgAA,4.0,"corporate_office, point_of_interest, establishment"
Elementum Parking,Rubbish place,False,False,,Corporate office,0,1.0,not spam,bad,ChIJX0ZjawAb2jERNrvnhPFXemU,https://maps.google.com/?cid=7312253639817935670&g_mp=Cilnb29nbGUubWFwcy5wbGFjZXMudjEuUGxhY2VzLlNlYXJjaE5lYXJieRAAGAQgAA,4.0,"corporate_office, point_of_interest, establishment"
Adam Food Centre,"Ibrahim Mee Stall, regretted buying mee goreng from, oily & small portion, stall owner serve people who jump queue & sarcastic, not going back!!!",False,True,,Hawker center,0,1.0,not spam,bad,ChIJv4Mk4QYa2jERlGncaOIvpW4,https://maps.google.com/?cid=7972831364797720980&g_mp=Cilnb29nbGUubWFwcy5wbGFjZXMudjEuUGxhY2VzLlNlYXJjaE5lYXJieRAAGAQgAA,4.1,"restaurant, food, point_of_interest, establishment"
Adam Food Centre,Stall 22 fried kway teow one of those that brought down the standard of local fried kway teow. Totally too sweet with fish cake slices! Horrible taste. One of the worse ever.,False,True,,Hawker center,0,1.0,not spam,bad,ChIJv4Mk4QYa2jERlGncaOIvpW4,https://maps.google.com/?cid=7972831364797720980&g_mp=Cilnb29nbGUubWFwcy5wbGFjZXMudjEuUGxhY2VzLlNlYXJjaE5lYXJieRAAGAQgAA,4.1,"restaurant, food, point_of_interest, establishment"
Coronation Shopping Plaza,"Horrendous. Escalator broke down. Went up with our trolley of groceries and had to carry it back down?!

Toilets are super clean though.

Shops upstairs seem to be in another world. Hardly any customers, very old world and a wonderful slow slow pace of life except that the shops' staff cannot be bothered with customers so overall not a place worth visiting",False,True,,Shopping mall,0,1.0,not spam,bad,ChIJ08duKAYa2jER47-5U4ZdgAo,https://maps.google.com/?cid=756707568909926371&g_mp=Cilnb29nbGUubWFwcy5wbGFjZXMudjEuUGxhY2VzLlNlYXJjaE5lYXJieRAAGAQgAA,3.9,"shopping_mall, point_of_interest, establishment"
Coronation Shopping Plaza,The loading bay  outside is barricaded and unfriendly for shoppers at NTUC finest in particular the older customers. Unlike the other NTUC outlets in Spore they did not retrofit the frontage such that it is more user friendly and safer for customers to load their groceries to the car and there is no lift that goes directly to the basement carpark for trolleys.,False,False,,Shopping mall,0,1.0,not spam,bad,ChIJ08duKAYa2jER47-5U4ZdgAo,https://maps.google.com/?cid=756707568909926371&g_mp=Cilnb29nbGUubWFwcy5wbGFjZXMudjEuUGxhY2VzLlNlYXJjaE5lYXJieRAAGAQgAA,3.9,"shopping_mall, point_of_interest, establishment"
Roland Restaurant | The Best Chilli Crab & Popular Chinese Seafood Restaurant (Katong-East Coast),"We have been to Roland many times thru the years with good food. Unfortunately, it seems that standards has dropped tremendously for the dim sum. Everything was over fried or tasteless and when served, didn't even look appetising.

Maybe Roland might know, since he was at the next table speaking only with the ladies that was enjoying crabs but avoided talking to tables that had dim sum. We would otherwise have given him the feedback directly and shared our disappointment.

The staff took no care either. They only came rushing to pour our tea when I started to pour it myself, and they saw that boss was at the next table.

It really is quiet sad the current state, but I guess we won't be back there anymore.",False,True,,Seafood restaurant,0,1.0,not spam,bad,ChIJGVCKbHEY2jERe4sLs53yWvg,https://maps.google.com/?cid=17895882828437752699&g_mp=Cilnb29nbGUubWFwcy5wbGFjZXMudjEuUGxhY2VzLlNlYXJjaE5lYXJieRAAGAQgAA,4.3,"seafood_restaurant, restaurant, point_of_interest, food, establishment"
Roland Restaurant | The Best Chilli Crab & Popular Chinese Seafood Restaurant (Katong-East Coast),"Crab is expensive at $88/kg. But for the premium price I didn’t get a premium grade of crab. The crab meat is mushy and the chilli crab was not served hot. Seem like it was separated cooked and the sauce was poured over it. When we feedback to the staff she dare not respond to us how the crab was cooked and quickly walked away.

Won’t be returning. There are better food out there.",False,True,,Seafood restaurant,0,1.0,not spam,bad,ChIJGVCKbHEY2jERe4sLs53yWvg,https://maps.google.com/?cid=17895882828437752699&g_mp=Cilnb29nbGUubWFwcy5wbGFjZXMudjEuUGxhY2VzLlNlYXJjaE5lYXJieRAAGAQgAA,4.3,"seafood_restaurant, restaurant, point_of_interest, food, establishment"
Immigration & Checkpoints Authority,"Waited more than 2 hours to collect passport and still waiting. Furthermore, We had made an appointment.
Approached a random staff to ask and she informed that there was a system issue. Shouldn't there be any backup?  Some waited for 3 hours. No proactive efforts made to address the long queue.",False,False,,Immigration & naturalization service,0,1.0,not spam,bad,ChIJM-4d4bUZ2jEReqCBDPuE7Dk,https://maps.google.com/?cid=4173857168447086714&g_mp=Cilnb29nbGUubWFwcy5wbGFjZXMudjEuUGxhY2VzLlNlYXJjaE5lYXJieRAAGAQgAA,3.2,"government_office, point_of_interest, establishment"
Immigration & Checkpoints Authority,"I called the ICA hotline today (20 June 2025) to check if I could collect my passport four days earlier than the scheduled date (24 June), from ICA HQ instead of Jurong SingPost. After explaining my situation, the officer on the phone kindly told me that I could head down to ICA HQ and that there was a possibility I might be able to collect it there.

I arrived at 12:00 PM and explained my case to the counter staff. The lady at the counter was polite and helpful. She said if the passport was in the building, I would definitely get a queue number, and told me to return before 4:00 PM or wait for a call.

At 3:26 PM, I got a call from an officer (unfortunately I didn’t get her name) informing me that the passport was actually at Jurong SingPost. I explained again that I needed the passport urgently as I am leaving on 22 June, and the official collection date is 24 June. She said I could go to Level 2 counter 23 and speak to an officer directly — no need to queue.

I waited from 4:05 PM to 5:00 PM at Level 2 Counter 23. An elderly staff member spoke to me and said she would check. Then Officer Jirach came out and bluntly told me they couldn’t help and ""Even I would, it's wrong timing.""

What does ""Even I would, it's wrong timing."" even mean?

It was just past 5PM — ICA was still open.

SingPost closes at 8PM.

I followed all the instructions I was given — yet still received no assistance.

This is not just about a passport. It’s about time, money, and dignity.

I wasted my whole afternoon and travel costs just to be dismissed coldly by someone who didn’t even try to help. If the system was more consistent and transparent, or if officers had more compassion, this wouldn’t have happened.

Honestly, this kind of attitude can easily be replaced by a computer — and it would probably do a better job, without the attitude.

I still want to thank the call centre staff and the initial counter lady — they were respectful and tried to help.

But the two officers at Level 2, especially Jirach, should not be front-facing if they are unable or unwilling to assist the public with basic courtesy.

Extremely disappointed with how this was handled.",False,True,,Immigration & naturalization service,0,1.0,not spam,bad,ChIJM-4d4bUZ2jEReqCBDPuE7Dk,https://maps.google.com/?cid=4173857168447086714&g_mp=Cilnb29nbGUubWFwcy5wbGFjZXMudjEuUGxhY2VzLlNlYXJjaE5lYXJieRAAGAQgAA,3.2,"government_office, point_of_interest, establishment"
Buona Vista,"MRT was worst and the train was pack of people, want to have a peaceful MRT station and barge in with a group of people, what the heck is this and LTA never wake up their own idea in the east west line. Should have build a bus interchange for the Buona Vista for the empty field and plus when I was suppose to go to church at commonwealth. The whole train was full of packs with people. Didn't build any LRT trains, shuttle bus and free bus for commonwealth and Buona Vista.",False,True,,Subway station,0,1.0,not spam,bad,ChIJsQvqY0Ia2jER_QrezH_adnY,https://maps.google.com/?cid=8536250386160159485&g_mp=Cilnb29nbGUubWFwcy5wbGFjZXMudjEuUGxhY2VzLlNlYXJjaE5lYXJieRAAGAQgAA,4.0,"subway_station, transit_station, point_of_interest, establishment"
Buona Vista,"signage and directions there are unclear. i went there with my friend to go to the moe hq. we left via the green line exit as we were from the green line.  seeing the sign that said “moe hq (ghim moh)”, we followed the directions as we were only aware that the moe hq is near the mrt station. after walking for 22 minutes, me and my friend reached the hq only to find out that we were at the WRONG moe hq. the correct moe hq was opposite the mrt station and we had to walk through the underpass and exit through the circle line exit. if the directions were more clear, stating the directions of “moe hq (bouna vista)” which is the nearest one, me and my friend would not have been late to our meeting.",False,False,,Subway station,0,1.0,not spam,bad,ChIJsQvqY0Ia2jER_QrezH_adnY,https://maps.google.com/?cid=8536250386160159485&g_mp=Cilnb29nbGUubWFwcy5wbGFjZXMudjEuUGxhY2VzLlNlYXJjaE5lYXJieRAAGAQgAA,4.0,"subway_station, transit_station, point_of_interest, establishment"
Kallang MRT Station (EW10),Not good,False,False,,Railway services,0,1.0,not spam,bad,ChIJsx29uk8Z2jERmPP-HR07M9U,https://maps.google.com/?cid=15362687750134231960&g_mp=Cilnb29nbGUubWFwcy5wbGFjZXMudjEuUGxhY2VzLlNlYXJjaE5lYXJieRAAGAQgAA,4.5,"point_of_interest, establishment"
