title,text,url,isAdvertisement,isLocalGuide,responseFromOwnerText,categoryName,likesCount,stars,Unnamed: 9,spam_label,sentiment_label
Paya Lebar MRT Station (EW8),"Singapore’s MRT stations are exceptionally clean, efficient, and well-organized, reflecting the city’s commitment to seamless public transport. The signage is clear, and announcements are made in multiple languages, making navigation easy for locals and tourists alike. Most stations are air-conditioned and equipped with essential amenities such as escalators, elevators, and ticketing machines. Some central stations also feature retail shops and food stalls, adding convenience for commuters. However, peak hours can get crowded, so traveling during off-peak times is recommended for a more comfortable experience.",https://www.google.com/maps/search/?api=1&query=Paya%20Lebar%20MRT%20Station%20(EW8)&query_place_id=ChIJn9toHfIZ2jERUP7cso2BKYs,FALSE,TRUE,,Railway services,0,5,,not spam,good
Paya Lebar MRT Station (EW8),I would like to give my heartfelt thanks to Mr. Harry from Paya Lebar MRT Station in Singapore for his outstanding service. He was not only efficient but also kind and friendly while assisting me in searching for an item I had left behind in the MRT. I was extremely happy when my item was found. His dedication and genuine care turned a stressful situation into a reassuring one. Truly grateful for his effort and professionalism!,https://www.google.com/maps/search/?api=1&query=Paya%20Lebar%20MRT%20Station%20(EW8)&query_place_id=ChIJn9toHfIZ2jERUP7cso2BKYs,FALSE,FALSE,,Railway services,0,5,,not spam,good
Old Airport Road Food Centre,"One of the most iconic hawker centres, known for its wide variety of local favourites & legendary stalls. Lively, spacious & full of heritage. Linked sheltered walkway to MSCP Block 49A. Expect long queues at famous stalls",https://www.google.com/maps/search/?api=1&query=Old%20Airport%20Road%20Food%20Centre&query_place_id=ChIJWzTvXEcY2jERvSzB8XNKKCk,FALSE,TRUE,,Hawker center,0,5,,not spam,good
Old Airport Road Food Centre,"One of my favourite hawker center, you can find plenty of local delights here and their price are reasonable too
You can take MRT to reach here, if im not wrong is Dakota station, short walking distant to the hawker centre. This hawker centre is very packed in the evening but there are many fan around so not very stuffy. There is a newly built Multi storey carpark, so drive to park here is more convenient now compare to last time.",https://www.google.com/maps/search/?api=1&query=Old%20Airport%20Road%20Food%20Centre&query_place_id=ChIJWzTvXEcY2jERvSzB8XNKKCk,FALSE,TRUE,,Hawker center,0,5,,not spam,good
National Junior College,"After 15 years, NJC's boarding school (only) was officially closed in 2024 to return the land for state use.

These images hope to honour the memories of those 500 students and teachers boarded there every year

For more at #shuutur",https://www.google.com/maps/search/?api=1&query=National%20Junior%20College&query_place_id=ChIJ61lTU6EQ2jERiBDECMxHYFY,FALSE,TRUE,,Junior college,0,5,,not spam,good
National Junior College,"Best school ever. The teachers and students are super kind and helpful, I would definitely say this school is better than raffles institution because the facilities and other things are Soo much better and newer",https://www.google.com/maps/search/?api=1&query=National%20Junior%20College&query_place_id=ChIJ61lTU6EQ2jERiBDECMxHYFY,FALSE,FALSE,,Junior college,0,5,,not spam,good
City Plaza,"City Plaza is one of those underrated shopping spots in Singapore that truly surprises you once you explore it properly. Located near Paya Lebar MRT, it’s not a flashy mall like the newer ones—but it offers a unique charm that comes from being packed with small shops, local boutiques, and affordable fashion.

What I love most is the variety of budget-friendly clothes, especially trendy and pre-loved fashion. If you like thrift shopping or K-fashion styles, this is the place to dig in. Many online blogshops actually source their items from here, so you can get the same outfits at much lower prices.

It also has tailor shops, beauty salons, and a few places to eat like Arnold's Fried Chicken (super popular!). The building is a bit old and the layout isn’t the easiest to navigate, but that’s part of the adventure. Definitely not your modern mall experience, but it’s got its own character.

💡 Tip: Come on weekdays if you want to avoid crowds. And don’t be afraid to bargain at some of the stores!",https://www.google.com/maps/search/?api=1&query=City%20Plaza&query_place_id=ChIJ34RyshcY2jERneNcLqsPK3o,FALSE,TRUE,,Shopping mall,0,5,,not spam,good
City Plaza,Recently had my iPhone 11 back glass replacement and everything is good.. happy with the outcome.,https://www.google.com/maps/search/?api=1&query=City%20Plaza&query_place_id=ChIJ34RyshcY2jERneNcLqsPK3o,FALSE,FALSE,,Shopping mall,0,5,,not spam,good
Aljunied MRT Station (EW9),"The place is clean, and the staff is very helpful. There are a couple of good restaurants just outside the metro station, and you can easily recharge your metro EZ-Link card at one of the counters.",https://www.google.com/maps/search/?api=1&query=Aljunied%20MRT%20Station%20(EW9)&query_place_id=ChIJ_SPrMTsY2jER_LeXO03QXgs,FALSE,TRUE,,Railway services,0,5,,not spam,good
Aljunied MRT Station (EW9),"All the MRT stations in Singapore are nice, clean and easy to use.  Aljunied was no different, an easy to navigate system that we used a lot whilst in Singapore.  Each trip cost around 1-2 euros.",https://www.google.com/maps/search/?api=1&query=Aljunied%20MRT%20Station%20(EW9)&query_place_id=ChIJ_SPrMTsY2jER_LeXO03QXgs,FALSE,TRUE,,Railway services,0,5,,not spam,good
Mandarin Gardens,"Mandarin Gardens is a large and well-established condominium complex known for its expansive open spaces and lush surroundings. It offers a wide range of recreational facilities beyond just a swimming pool — including multiple tennis courts and squash courts, a rare feature among condominiums.

Popular with expatriates, Mandarin Gardens is ideally located near East Coast Park and the beach, providing easy access to outdoor activities and a vibrant seaside lifestyle.
The property is also well-connected by a comprehensive bus network right at its doorstep, ensuring a smooth and convenient commute to other parts of Singapore.",https://www.google.com/maps/search/?api=1&query=Mandarin%20Gardens&query_place_id=ChIJ64eWvKIi2jERqjmB7_qOOhQ,FALSE,TRUE,,Condominium complex,0,5,,not spam,good
Mandarin Gardens,"An old project but very spacious and has numerous facilities. There is a restaurant called 'Thai Pan' open to public. There are 4 tennis courts (need to book in advance), table tennis room, squash court, swimming pool, gym, steam room and sauna. Also there are BBQ pits alongside the swimming pool. There are side gates which allows entry into an underpass which will lead to East Coast Park.",https://www.google.com/maps/search/?api=1&query=Mandarin%20Gardens&query_place_id=ChIJ64eWvKIi2jERqjmB7_qOOhQ,FALSE,TRUE,,Condominium complex,0,5,,not spam,good
Dakota MRT Station (CC8),"Great station for travelling between Mountbatten and paya lebar. Other than that, not much. Just a toilet and an information counter. Not much to expect in a mrt station.",https://www.google.com/maps/search/?api=1&query=Dakota%20MRT%20Station%20(CC8)&query_place_id=ChIJr36MxgkZ2jER7U1scqQWtGY,FALSE,TRUE,,Railway services,0,5,,not spam,bad
Dakota MRT Station (CC8),I like how nice the platform doors are and how shiny and the same design as Tai Seng,https://www.google.com/maps/search/?api=1&query=Dakota%20MRT%20Station%20(CC8)&query_place_id=ChIJr36MxgkZ2jER7U1scqQWtGY,FALSE,TRUE,,Railway services,0,5,,not spam,good
Geylang East Public Library,"The library has a dedicated children's section that is welcoming, engaging and safe. The kid's area is designed with bright colors, comfy seating and fun decorations.",https://www.google.com/maps/search/?api=1&query=Geylang%20East%20Public%20Library&query_place_id=ChIJQyTTUCMY2jERunI_GcAyOug,FALSE,TRUE,,Public library,0,5,,not spam,good
Geylang East Public Library,"Library collection map for free and  if you borrow books, earn points exchange for bug cards using vending machine. There are a total of 100 types of bug cards.

For details information, ask librarian for assistance.",https://www.google.com/maps/search/?api=1&query=Geylang%20East%20Public%20Library&query_place_id=ChIJQyTTUCMY2jERunI_GcAyOug,FALSE,TRUE,,Public library,0,5,,not spam,good
Sinopec Bukit Timah,"Was not here to pump petrol but rather visited Sinopec's convenience store, Easy Joy. Super delightful experience with a wide range of snacks (including local and imported snacks - korea and japan included), drinks which were very affordable and with frequent sales, as well as staples like rice and bread. They also had a great variety of instant food on offer and even ready to eat meals that just need to be put into the microwave (also available in store). Ready to eat meals are of a local range and while portion is not great, taste was pretty good.

There was also frozen dumplings, tools and gadgets for cars interior and exterior, wide range of super cute toys for children, sweets, packet drinks. Basically you'll find everything you need here and I find myself coming here for ""grocery"" runs fairly often or just to get some snacks since it's so convenient and well stocked and round the corner from where I live.

Excellent, amazing and easy joy indeed!",https://www.google.com/maps/search/?api=1&query=Sinopec%20Bukit%20Timah&query_place_id=ChIJ3ek_uDgb2jERH_bUmFEJ6uQ,FALSE,TRUE,"Thank you for sharing your amazing experience at our Easy Joy convenience store! We're delighted to hear that you find our selection of snacks, drinks, and ready-to-eat meals to be affordable and well-stocked. We appreciate your support and look forward to your next visit.",Gas station,0,5,,not spam,good
Sinopec Bukit Timah,"Fav petrol station in Sg!! Apart from the instant 25% discount, this petrol station gives off happy vibrant vibes. The pump attendants are always so jovial. The food selection inside seems to be of wider variety of other petrol stations. They have cute toys & clean toilet too!",https://www.google.com/maps/search/?api=1&query=Sinopec%20Bukit%20Timah&query_place_id=ChIJ3ek_uDgb2jERH_bUmFEJ6uQ,FALSE,TRUE,,Gas station,0,5,,not spam,good
Fourth Avenue Residences,Came to visit a friend new home. Beautiful new development in District 10. Near many good primary school and mins to MRT and orchard.,https://www.google.com/maps/search/?api=1&query=Fourth%20Avenue%20Residences&query_place_id=ChIJsdsas2ER2jERStdWxVuqeWU,FALSE,TRUE,,Condominium complex,0,5,,not spam,good
Fourth Avenue Residences,"Just went to recently TOP Fourth Avenue Residences,

Pro: Layout is efficient, 3 and 4 bedder very good sized, pool view is majestic. Children playground is major plus for families with kids and multiple side gates connect to Sixth Avenue MRT. Overall attributes better than nearby Royal green

Con: Triangular land plot limit the landscape and facilities but developer did well to overcome limitation. Price has high premium over its FH resale peers, no transformation in area so may need to wait for Turf city site to be launched",https://www.google.com/maps/search/?api=1&query=Fourth%20Avenue%20Residences&query_place_id=ChIJsdsas2ER2jERStdWxVuqeWU,FALSE,TRUE,,Condominium complex,0,5,,not spam,good
Aljunied,"Bustling MRT station in one of the most interesting district of Singapore, Geylang. The station is very spacious with car parks, bike park, surrounding with shop houses and restaurants.

We stayed in Geylang on our last visit and it is very convenience to as the Station is just a few hundred meters from our hotel, and it’s the same line back-and-forth to the Changi Airport. Love the place, and whenever we alight from the MRT, the station makes us feels like home.",https://www.google.com/maps/search/?api=1&query=Aljunied&query_place_id=ChIJO7BsLzsY2jER-OVKkQKKm64,FALSE,TRUE,,Subway station,0,5,,not spam,good
Aljunied,I was impressed.  no need to buy a ticket.  Place your card on the turnstile and you can take the metro. when traveling I always use eSIM cards from e-sim.cards,https://www.google.com/maps/search/?api=1&query=Aljunied&query_place_id=ChIJO7BsLzsY2jER-OVKkQKKm64,FALSE,TRUE,,Subway station,0,5,,not spam,good
Singapore Island Country Club (Bukit Location),"I was invited here as a guest. A beautifully kept golf course and facility. We had lunch and the food was exceptional. The best beef chow fun I ever had in Asia. It out did mom’s home cooked beef chow fun.

The gym and other areas are beautiful. Well kept and clean. Unfortunately you have to be a member to use the facilities and eat here.",https://www.google.com/maps/search/?api=1&query=Singapore%20Island%20Country%20Club%20(Bukit%20Location)&query_place_id=ChIJNecNarcQ2jERdw5GN_6OhK4,FALSE,TRUE,,Country club,0,5,,not spam,good
Singapore Island Country Club (Bukit Location),Super friendly staff and plesant members too. Congrats on being the best Cowgrass course ever. Nice greens true too.,https://www.google.com/maps/search/?api=1&query=Singapore%20Island%20Country%20Club%20(Bukit%20Location)&query_place_id=ChIJNecNarcQ2jERdw5GN_6OhK4,FALSE,TRUE,,Country club,0,5,,not spam,good
Sri Sivan Temple,"The Sri Sivan Temple at 24 Geylang East Avenue 2, Singapore 389752, has a rich history dating back to the 1850s. Here's a brief overview¹ ² ³:
- *Early Beginnings*: The temple was originally built in Potong Pasir and later relocated three times - first to Dhoby Ghaut, then to a site near MacDonald House, and finally to Serangoon Road.
- *Reconstruction and Relocation*: The temple was rebuilt as a solid structure in the early 1850s at the Orchard Road site, now occupied by the Dhoby Ghaut MRT station. After a decade of temporary residence at Serangoon Road, the temple was consecrated at its present Geylang East site on May 30, 1993.
- *Design and Construction*: The new temple was designed with a unique octagonal structure, featuring a multi-purpose hall and staff quarters. The construction cost $6 million and was built on a 3,000 sq. meter plot, approximately four-and-a-half times larger than its former site at Orchard Road.
- *Management*: The temple is managed by the Hindu Endowments Board, which was formed in 1968 to oversee the management of several temples, including Sri Sivan Temple.
- *Consecration Ceremonies*: The temple has undergone two consecration ceremonies - the first on May 30, 1993, and the second on January 27, 2008.

Today, the Sri Sivan Temple is a prominent Hindu temple in Singapore, dedicated to Lord Shiva and featuring stunning Dravidian architecture.⁴

GKC...",https://www.google.com/maps/search/?api=1&query=Sri%20Sivan%20Temple&query_place_id=ChIJz46D4yIY2jERT2ClyKkbF2U,FALSE,TRUE,,Hindu temple,0,5,,not spam,good
Sri Sivan Temple,"The temple at its current 3,000 sq m site was first consecrated in 1993 when it was a newly built structure, after moving from a temporary place of worship in Serangoon Road, next to Srinivasa Perumal Temple.",https://www.google.com/maps/search/?api=1&query=Sri%20Sivan%20Temple&query_place_id=ChIJz46D4yIY2jERT2ClyKkbF2U,FALSE,TRUE,,Hindu temple,0,5,,not spam,good
Paya Lebar,"Love this MRT as it is close to Shopping Malls and offices. With 2 lines (Circle Line and East West Line), travelling to most part of Singapore is very convenient.

It is also lively with the various stores, water fountain in between the PLQ Mall and office, like the fact that there are many exits and covered shelter area to make it easier to get around the area.",https://www.google.com/maps/search/?api=1&query=Paya%20Lebar&query_place_id=ChIJU-xrGhgY2jERLX7VN6dXpsA,FALSE,TRUE,,Subway station,0,5,,not spam,good
Paya Lebar,Inter change between Green line and Orange line. The unique location provides easy access to the food court and the Paya Lebar Square,https://www.google.com/maps/search/?api=1&query=Paya%20Lebar&query_place_id=ChIJU-xrGhgY2jERLX7VN6dXpsA,FALSE,TRUE,,Subway station,0,5,,not spam,good
Marymount MRT Station (CC16),"very convenient for me with the connection of the circle line. this stations is very accessible and also helps me reach different places via the circle line, like Serangoon. marymount station is a good location for many to access too. everytime i can take the mrt and reach other places to eat with friends",https://www.google.com/maps/search/?api=1&query=Marymount%20MRT%20Station%20(CC16)&query_place_id=ChIJ0087lXcX2jERja3SYAbb1L0,FALSE,TRUE,,Railway services,0,5,,not spam,good
Marymount MRT Station (CC16),"The washroom is clean. Probably because there aren't that many crowds that use the washroom there.

The security there are quite active. They do check bags once in a while.",https://www.google.com/maps/search/?api=1&query=Marymount%20MRT%20Station%20(CC16)&query_place_id=ChIJ0087lXcX2jERja3SYAbb1L0,FALSE,TRUE,,Railway services,0,5,,not spam,good
RoyalGreen Condominium,"Resort style freehold condo near MRT with amenities at it’s door step. Full facilities with tennis court, Urban garden, BBQ pavilion on its roof top to allow for vast greeneries and landscape on ground level. Few units available as of date.",https://www.google.com/maps/search/?api=1&query=RoyalGreen%20Condominium&query_place_id=ChIJVQ99T7ob2jERNaXB_mMtdZA,FALSE,TRUE,,Condominium complex,0,5,,not spam,good
RoyalGreen Condominium,Absolutely love this condo!,https://www.google.com/maps/search/?api=1&query=RoyalGreen%20Condominium&query_place_id=ChIJVQ99T7ob2jERNaXB_mMtdZA,FALSE,TRUE,,Condominium complex,0,5,,not spam,good
Keppel Club,"Is fantastic, can see all staff putting in the effort for this dinosaur park, music and display, lighting and atmosphere , details of how dinosaurs being grown plus one big dinosaur rush up to give a surprise, well done team of keppel, wish all successful and keep it up.",https://www.google.com/maps/search/?api=1&query=Keppel%20Club&query_place_id=ChIJ2QdCQegb2jERpeuye8JoFDw,FALSE,FALSE,,Country club,0,5,,not spam,good
Keppel Club,"Just finished the Jurassic Park adventure with Keppel club, amazing set up and it was so Funtastic!

We had a social OSOK Golf Community Tournament in June 2025
Amazing service by Evelyn even though we have only 2-3 flights. She is fast in her follow up, sincere and always look out for our team. Kudos Evelyn and team, keep it up! 👍",https://www.google.com/maps/search/?api=1&query=Keppel%20Club&query_place_id=ChIJ2QdCQegb2jERpeuye8JoFDw,FALSE,TRUE,,Country club,0,5,,not spam,good
Paya Lebar Quarter - PLQ 3,Nice chill area with nice food n a relaxing vibe. A lot of shops n restaurant at the basement level.,https://www.google.com/maps/search/?api=1&query=Paya%20Lebar%20Quarter%20-%20PLQ%203&query_place_id=ChIJocxFh44Z2jERWCEx6brwnsQ,FALSE,TRUE,,Corporate office,0,5,,not spam,good
Paya Lebar Quarter - PLQ 3,This place houses lots of offices. It has amazing vibes and ambience. This place is just next to the PLQ residences.,https://www.google.com/maps/search/?api=1&query=Paya%20Lebar%20Quarter%20-%20PLQ%203&query_place_id=ChIJocxFh44Z2jERWCEx6brwnsQ,FALSE,TRUE,,Corporate office,0,5,,not spam,good
J.B. Ah Meng Restaurant,"If you’re looking for a no-frills, authentic Singaporean zi char experience, JB Ah Meng is a must-visit. Tucked away in the heart of Geylang, this casual eatery is beloved by locals, foodies, and even Michelin-star chefs — and for good reason.

The White Pepper Crab is the star of the show. Unlike the more commonly found black pepper or chili versions, this dish stands out for its intense aroma, fiery white pepper kick, and juicy, perfectly cooked crab. It’s spicy but addictive — a dish you’ll crave long after the meal ends. But I highly suggest booking an appointment to avoid waiting time.",https://www.google.com/maps/search/?api=1&query=J.B.%20Ah%20Meng%20Restaurant&query_place_id=ChIJLQ-16_4Z2jERFj2nuT9QXas,FALSE,TRUE,,Chinese restaurant,0,5,,not spam,good
J.B. Ah Meng Restaurant,"Their bee hoon is a must that it has crispy edges, packed with wok hei. Loved the fried pork and the silky eggplant. The salted egg shrimp was rich, creamy, and addictive. Always crowded, but worth the wait. Classic late-night zi char spot in SG!!",https://www.google.com/maps/search/?api=1&query=J.B.%20Ah%20Meng%20Restaurant&query_place_id=ChIJLQ-16_4Z2jERFj2nuT9QXas,FALSE,TRUE,,Chinese restaurant,0,5,,not spam,good
Grandlink Square,"When to wedding dinner at Bijan.The place is big and the atmosphere is good and food was good also..Bride to be, can book your wedding ceremony with ease and no worries.",https://www.google.com/maps/search/?api=1&query=Grandlink%20Square&query_place_id=ChIJBe1nR0QEBBARewvYudV7Yww,FALSE,TRUE,,Shopping mall,0,5,,not spam,good
Grandlink Square,"Freehold, Good location, 4 mins walk to Paya Lebar MRT. Paya Lebar / Geylang  area gear for future transformation. Good investment choice",https://www.google.com/maps/search/?api=1&query=Grandlink%20Square&query_place_id=ChIJBe1nR0QEBBARewvYudV7Yww,FALSE,FALSE,,Shopping mall,0,5,,not spam,good
Guthrie House,"Steep slope into the carpark, missing signs for direction to get out of the carpark into the main road and tight parking spaces.

But hey! If it serves the purpose of alternative parking along the limited slots areas for people looking to patronize the eateries here, then it does deserve some commemoration right?

A useful shop for the rich along these streets is a 24/7 supermarket is something everyone appreciates.",https://www.google.com/maps/search/?api=1&query=Guthrie%20House&query_place_id=ChIJm4FN5MoR2jER2GHX6oHY6bU,FALSE,TRUE,,Business center,0,5,,not spam,good
Guthrie House,"Decent place in sixth avenue, not much amenities but at least it a 10 minute walk from the sixth avenue mrt station. Just a cold storage here and several smaller chain and outlet, mostly medical clinic and tuition centres. Not many footfall at this place when I visited.",https://www.google.com/maps/search/?api=1&query=Guthrie%20House&query_place_id=ChIJm4FN5MoR2jER2GHX6oHY6bU,FALSE,TRUE,,Business center,0,5,,not spam,bad
Paya Lebar Quarter - PLQ 2,"Grade A Office Buildings located in Paya Lebar. The transportation is excellent as it is directly connected to the Paya Lebar MRT. The closest exit is MRT Exit E.

Love the area as it is easy to get to CBD, Malls, SingPost, Banks and other facilities. Many pubs/restaurants/cafes right below the office too.",https://www.google.com/maps/search/?api=1&query=Paya%20Lebar%20Quarter%20-%20PLQ%202&query_place_id=ChIJW211-dMZ2jERrG_ZNITnp5s,FALSE,TRUE,,Corporate office,0,5,,not spam,good
Paya Lebar Quarter - PLQ 2,"Cool place, lots of happening. Spacious. Well use retail space. Relaxing yet busy",https://www.google.com/maps/search/?api=1&query=Paya%20Lebar%20Quarter%20-%20PLQ%202&query_place_id=ChIJW211-dMZ2jERrG_ZNITnp5s,FALSE,TRUE,,Corporate office,0,5,,not spam,good
Toa Payoh,Toa Payoh is very convenient especially if living at Trellis Tower. Many buses at the back gate of condo and can stroll 8 minutes to Toa Payoh Mrt station / Bus Interchange or take few buses ( from back gate ) just one bus stop to the Mrt / Bus Interchange/ Hdb Hub with full amenities of Town Centre. 👍,https://www.google.com/maps/search/?api=1&query=Toa%20Payoh&query_place_id=ChIJ48Ai4mYX2jER5M71MMdN5NY,FALSE,TRUE,,Subway station,0,5,,not spam,good
Toa Payoh,"Toa Payoh is a mature town and accessible to most of the commercial services such as banking, postal services, F & B services. MRT station and Bus Terminal are at the town
centre.Also HDB office is also here.It is convenient to go anywhere in Singapore because of its central location
and  has a very good public transport system.",https://www.google.com/maps/search/?api=1&query=Toa%20Payoh&query_place_id=ChIJ48Ai4mYX2jER5M71MMdN5NY,FALSE,TRUE,,Subway station,0,5,,not spam,good
Gem Residences,"Great amenities, large pool with jacuzzis, indoor and outdoor gym, tennis court, rooftop BBQ with TV, concierge, EV charging stations, pet pool with pet wash machine.

Location is walking distance to many local markets, food courts, temples and churches, schools, mrt. Orchard is only 22mins away.",https://www.google.com/maps/search/?api=1&query=Gem%20Residences&query_place_id=ChIJgUSj4W8X2jERgZPZQIq4F20,FALSE,TRUE,,Condominium complex,0,5,,not spam,good
Gem Residences,"The management council has been listening to resident feedback and proactively addressing needs. Impressive improvements across the condominium can be seen with ongoing extensive repair and restoration works. Practical enhancements have also been made like the designation of a new bicycle maintenance station and enhancement to the lighting made the condo brighter and very welcoming. There are also modern additions like facial recognition boost security and convenience. It's fantastic to see such a responsive council committed to continuous upgrades – and of course, the unobstructed firework views during National Day and New Year's Eve from the unit are an incredible bonus!",https://www.google.com/maps/search/?api=1&query=Gem%20Residences&query_place_id=ChIJgUSj4W8X2jERgZPZQIq4F20,FALSE,TRUE,,Condominium complex,0,5,,not spam,good
