title,text,url,isAdvertisement,isLocalGuide,responseFromOwnerText,categoryName,likesCount,stars,Unnamed: 9,spam_label,sentiment_label
Shangri-La Singapore,The best hotel experience I’ve ever had with my family. Staff remembering us by our names and being the sweetest to my little ones. Friendliness and attentiveness were insanely amazing and I was blown away with their spectacular service with everything. Very detailed. Well trained. Super genuine. Each staff we met deserve to be rewarded. Amazing team!,https://www.google.com/maps/search/?api=1&query=Shangri-La%20Singapore&query_place_id=ChIJXU9FcvQZ2jERiz8HeaqV70E,FALSE,FALSE,"Dear Alissa,

Thank you for sharing such a heartfelt review. We are thrilled to hear that your family enjoyed your stay at Shangri-La Singapore and that our team made a memorable impression on you and your little ones.

It is especially rewarding to know that the attentiveness, friendliness, and personalised service of our staff exceeded your expectations. Your kind words have been shared with the team, and I am certain they will be inspired by your generous feedback.

We look forward to welcoming you and your family back for another exceptional and memorable stay.

Best regards,
Stephan Kapek
General Manager",Hotel,0,5,,not spam,good
Velocity @ Novena Square,Overall good mall with plenty of restaurant choose from. Was here after many years today came for oppo service center.,https://www.google.com/maps/search/?api=1&query=Velocity%20%40%20Novena%20Square&query_place_id=ChIJVVVVcOcZ2jERuHgJL1B5Aj4,FALSE,TRUE,,Shopping mall,0,5,,not spam,good
Velocity @ Novena Square,This mall has been around for a long time and is still thriving after all these years! Love that it is conveniently located right above Novena MRT on the North South Line. Walking distance from other malls too with shelter nearby. Lots of eateries here as well as sports shops. Will be back!,https://www.google.com/maps/search/?api=1&query=Velocity%20%40%20Novena%20Square&query_place_id=ChIJVVVVcOcZ2jERuHgJL1B5Aj4,FALSE,TRUE,,Shopping mall,0,5,,not spam,good
Apple Orchard Road,"One of my favorite Apple Stores ever!

The store has a gorgeous two-floor design.

The staff are very nice, kind, and helpful.

“Today at Apple” sessions are held on the second floor.

The space is bright, spacious, and beautifully lit, creating a very welcoming atmosphere.

Definitely will be back again if I have a chance.",https://www.google.com/maps/search/?api=1&query=Apple%20Orchard%20Road&query_place_id=ChIJB0Zz1ZMZ2jERimYnkTZmS-k,FALSE,TRUE,,Electronics store,0,5,,not spam,good
Apple Orchard Road,"I had an issue with my iPhone 16 Pro Max showing colored lines on the screen, and I was honestly expecting the worst. But the service at Apple was amazing, smooth, efficient, and professional.

The staff who assisted me (he was wearing a cap, i didn’t catch his name!) was friendly, patient, and reassuring. He explained everything clearly and made the process stress-free. What I thought would be a costly repair turned out to be a warranty-covered fix.

Definitely recommending this Apple service center. Big thank you to the team especially the kind staff wearing the cap and the young lady who both served me between 5.30pm - 7pm on 24 June. 👏👏👏",https://www.google.com/maps/search/?api=1&query=Apple%20Orchard%20Road&query_place_id=ChIJB0Zz1ZMZ2jERimYnkTZmS-k,FALSE,TRUE,,Electronics store,0,5,,not spam,good
Ngee Ann City,"Ngee Ann City is one of the most iconic and upscale shopping destinations on Orchard Road — a must-visit for anyone coming to Singapore! The mall is home to a perfect mix of luxury brands, well-known international labels, local boutiques, and lifestyle stores, making it ideal for all kinds of shoppers.

The interior is spacious, elegant, and well-maintained, with a layout that’s easy to navigate. One of the highlights is Takashimaya, the massive Japanese department store inside, which offers everything from fashion and beauty products to home goods and gourmet food. The basement food hall is a paradise for food lovers — you’ll find everything from Japanese snacks and sushi to local delights.

There’s also a great selection of cafes and restaurants, offering both quick bites and full dining experiences. Whether you’re craving Asian cuisine, Western meals, or desserts, you’ll be spoiled for choice.

What makes Ngee Ann City stand out is not just its high-end shopping, but also the vibrant atmosphere, frequent events at the atrium, and excellent service throughout. It’s a place where shopping feels relaxing and enjoyable.

Highly recommended for tourists and locals alike. Whether you're window shopping, enjoying a meal, or treating yourself to something special, Ngee Ann City offers a truly complete and satisfying experience.",https://www.google.com/maps/search/?api=1&query=Ngee%20Ann%20City&query_place_id=ChIJ_7pt85EZ2jERPfKpmuwrzys,FALSE,TRUE,,Shopping mall,0,5,,not spam,good
Ngee Ann City,Went to try out this jap food.. taste  not too bad. The meat was soft but it taste like mince meat. The veg is nice too.,https://www.google.com/maps/search/?api=1&query=Ngee%20Ann%20City&query_place_id=ChIJ_7pt85EZ2jERPfKpmuwrzys,FALSE,TRUE,,Shopping mall,0,5,,not spam,good
Orchard Hotel Singapore,"Excellent hotel! The breakfast alone was worth the price of the hotel room fair. Amazing full course resort level breakfast! Rooms were clean, pool was awesome and not crowded.  Staff was friendly and very helpful.  Full grocery store that’s downstairs if you need anything.  Kid friendly! Definitely will stay again!",https://www.google.com/maps/search/?api=1&query=Orchard%20Hotel%20Singapore&query_place_id=ChIJ-ZtvtowZ2jER4uzcVTpI2S0,FALSE,FALSE,,Hotel,0,5,,not spam,good
Orchard Hotel Singapore,"★★★★★
Had a wonderful stay at The Orchard Hotel Singapore! The location is perfect right in the heart of the city with easy access to shopping and transport. Rooms were clean, modern, and very comfortable. The staff were friendly and professional, making the whole experience smooth and welcoming. Highly recommend for both business and leisure stays!",https://www.google.com/maps/search/?api=1&query=Orchard%20Hotel%20Singapore&query_place_id=ChIJ-ZtvtowZ2jER4uzcVTpI2S0,FALSE,TRUE,"Dear Sithupa,

Thank you for your wonderful review! We’re delighted to hear that you enjoyed your stay at Orchard Hotel Singapore and appreciated our central location, comfortable rooms, and the warm hospitality of our team.

It’s especially rewarding to know that our service made your experience smooth and welcoming. Whether for business or leisure, we’re thrilled to be your hotel of choice and truly appreciate your recommendation.

We look forward to welcoming you back for another memorable stay in the heart of the city.

Best Regards,
Nick Chia
Executive Assistant Manager",Hotel,0,5,,not spam,good
Hilton Singapore Orchard,"I recently stayed at Hilton Singapore Orchard and had a wonderful experience! The hotel is beautiful, clean, and very welcoming. From the concierge to check-in and housekeeping, every staff member I encountered was friendly and professional.

One of the highlights of my stay was the Executive Lounge. We had our breakfast there daily, and the service was exceptional. A special mention to Jimmy, he was incredibly attentive and ensured we were well taken care of throughout.

I highly recommend staying at Hilton Singapore Orchard. I’ll definitely be coming back!",https://www.google.com/maps/search/?api=1&query=Hilton%20Singapore%20Orchard&query_place_id=ChIJU2DzfLcZ2jER4WGAnEnqNFw,FALSE,FALSE,"Dear Kathy Victoria,

Thank you for taking the time to share your recent experience in Hilton Singapore Orchard and for giving us perfect 5-Star feedback.

We are expecting to welcome you back to our hotel next time you will travel to our area - please let me know if we can assist with booking and arrangements.

Kind Regards,
Raj Muniandy,
Duty Manager",Hotel,0,5,,not spam,good
Hilton Singapore Orchard,"I would like to extend my heartfelt thanks for the wonderful experience provided by your team—especially the exceptional staff at the Executive Lounge.

A special mention goes to Jimmy and Aurelius, who truly stood out during my stay. They were incredibly patient, attentive, and always made sure our needs were met with a smile. Their service consistently went above and beyond, and it made our time at the hotel not just comfortable, but truly memorable.

The entire Executive Lounge team deserves praise for their professionalism, warmth, and dedication to guest satisfaction. It’s rare to find such a consistently high level of service, and I hope their efforts are recognized and appreciated internally as much as they are by your guests.

Please convey my thanks and appreciation to Jimmy, Aurelius, and the rest of the team. I look forward to returning in the future and will gladly recommend Hilton Singapore Orchard to others.

Great job Hilton Singapore Team!",https://www.google.com/maps/search/?api=1&query=Hilton%20Singapore%20Orchard&query_place_id=ChIJU2DzfLcZ2jER4WGAnEnqNFw,FALSE,FALSE,"Dear Charis Low,

Thank you for taking the time to share such wonderful feedback regarding your stay at Hilton Singapore Orchard. It brings us immense joy to hear that you had such a memorable experience, especially in the Executive Lounge.

A special mention of appreciation will be shared with Jimmy, Aurelius, and the entire Executive Lounge team for their exceptional service. Their dedication to guest satisfaction truly exemplifies the spirit of hospitality that we strive to deliver.

We are grateful for your kind words and your willingness to recommend us. The team eagerly anticipates the opportunity to welcome you back for another exceptional stay.


With warmest regards,
Daisy Yew
Hilton Singapore Orchard",Hotel,0,5,,not spam,good
United Square Shopping Mall,"A smaller, but usefull shopingmall with many small useful shops and restaurants. The top dloor is tutirial place for music, language and other subjects. Always full.",https://www.google.com/maps/search/?api=1&query=United%20Square%20Shopping%20Mall&query_place_id=ChIJRX3v4ecZ2jERD0BlqjhXKCc,FALSE,TRUE,,Shopping mall,0,5,,not spam,good
United Square Shopping Mall,"It is another nearby shopping mall that is next to velocity. It is an old mall that you can find local brand shops. We can find many shops for moms and kids, children, families, etc.",https://www.google.com/maps/search/?api=1&query=United%20Square%20Shopping%20Mall&query_place_id=ChIJRX3v4ecZ2jERD0BlqjhXKCc,FALSE,TRUE,,Shopping mall,0,5,,not spam,good
Newton MRT Station (NS21),A convenient mrt station... Sheltered till u reach the Newton circus hawker center. Very impressive!,https://www.google.com/maps/search/?api=1&query=Newton%20MRT%20Station%20(NS21)&query_place_id=ChIJc25YLvQZ2jERs2ymuBdkbi8,FALSE,FALSE,,Railway services,0,5,,not spam,good
Newton MRT Station (NS21),"The red line side of Newton MRT has been relatively stable state since a long while back, serving commuters who are passing major areas of Singapore like Orchard, Bishan, and Toa Payoh. This station is also interchange to the blue line, if you're heading up towards Bukit Timah main road.

Just be mindful of the confusing interior, and ask the staff if you have any concerns whatsoever.",https://www.google.com/maps/search/?api=1&query=Newton%20MRT%20Station%20(NS21)&query_place_id=ChIJc25YLvQZ2jERs2ymuBdkbi8,FALSE,TRUE,,Railway services,0,5,,not spam,good
YOTEL Singapore Orchard Road,"Great Value Stay in the Heart of Orchard Road – YOTEL Singapore||We really enjoyed our stay at YOTEL Singapore. The location is unbeatable—right on Orchard Road, with easy access to shopping, dining, and transport.||The room is compact but smartly designed. If you’re not traveling with too much luggage, it works well. We had two suitcases and managed comfortably. The bed was very comfortable, and we appreciated the little touches like bottled water and a usable (though small) ironing board.||The bathroom and toilet area is open-concept with a partial glass wall to the main room. It was unique and gave a nice view of the city. Close the blinds if you don't want anyone seeing your shower or on the toilet. The bathroom did contribute to a slight musty smell, likely due to the shower being basically in the same space as the sleeping area. This room is only designed to share with people you are comfortable with as there is a lack of privacy. (You can see the outline of the person as they shower.)||The pool area is small but very well maintained, and open until 10pm, which was great for a relaxing evening swim. We also loved the funky restaurant next to the pool—fun vibe and good food.||Overall, this hotel offers great value for money, especially considering the central location. A solid option if you're looking for a modern, no-fuss stay in Singapore. We loved it.",https://www.google.com/maps/search/?api=1&query=YOTEL%20Singapore%20Orchard%20Road&query_place_id=ChIJdeB0FI0Z2jERfMMx7jtAfsg,FALSE,FALSE,,Hotel,0,5,,not spam,good
YOTEL Singapore Orchard Road,"Nice, clean and quaint hotel. On main Orchard Road where shops, cafes and sights to see are nearby. Metro and buses easy to acquire as well as Grab or taxis. Affordable and automated check in and checkout. Breakfast available for extra charge. Helpful front desk staff and cleaners.",https://www.google.com/maps/search/?api=1&query=YOTEL%20Singapore%20Orchard%20Road&query_place_id=ChIJdeB0FI0Z2jERfMMx7jtAfsg,FALSE,FALSE,,Hotel,0,5,,not spam,good
Wheelock Place,"Finally a premium audio lifestyle store at Wheelock Place. Great audio selection, impressive set up by TC Acoustic Team. Always love the great service by their team. You can feel the passion by the sales team. Visit them at Level 3, Wheelock Place. Take the escalator from Level 1 directly to Level 3 and you will see the store. Very convenient.",https://www.google.com/maps/search/?api=1&query=Wheelock%20Place&query_place_id=ChIJmbzds40Z2jERALKuryaSSVI,FALSE,TRUE,,Shopping mall,0,5,,not spam,good
Wheelock Place,"Beautiful building is the starting point of subway transportation or underground community shopping. In fact, to cross the road in this area, we  have to walk through or go near the building like this. Wheelock Place is one of the building that should go into.",https://www.google.com/maps/search/?api=1&query=Wheelock%20Place&query_place_id=ChIJmbzds40Z2jERALKuryaSSVI,FALSE,TRUE,,Shopping mall,0,5,,not spam,good
Sultan Mosque,"What a lovely afternoon exploring Arab Street! The whole area is full of charm with colorful little shops and friendly vendors. I wandered around with no real plan and ended up with a delicious snack in hand and a beautiful blue pendant with green emerald details from a Turkish shop. It was such a nice surprise.

The highlight was visiting Sultan Mosque. It is absolutely gorgeous in person. The golden dome catches your eye from far away and the entire place has a peaceful and welcoming atmosphere. If you’re in Singapore, make sure to stop by. It is a perfect mix of culture, color, and calm.",https://www.google.com/maps/search/?api=1&query=Sultan%20Mosque&query_place_id=ChIJb6xq2bAZ2jERE1P6sVKtofw,FALSE,TRUE,,Mosque,0,5,,not spam,good
Sultan Mosque,"Historical mosque and a must to visit place in Singapore, very well maintained and plenty of space for five time prayers. This area is also great to visit halal restaurants. Highly recommended if you are visiting Singapore as a tourist.",https://www.google.com/maps/search/?api=1&query=Sultan%20Mosque&query_place_id=ChIJb6xq2bAZ2jERE1P6sVKtofw,FALSE,TRUE,,Mosque,0,5,,not spam,good
Mount Elizabeth Hospital,"Review for Dr. Nicolas Kon – Mount Elizabeth Hospital, Singapore

We came to Mount Elizabeth Hospital in Singapore from Sri Lanka for my mother’s surgery for Trigeminal Neuralgia. From the very beginning, Dr. Nicolas Kon and his assistant made us feel completely at ease. We had no doubt we were in safe hands. Dr. Kon’s professionalism, compassion, and dedication went far beyond our expectations.

The surgery was a complete success, and we are so thankful for that. But what truly touched us was how deeply he cared, not just medically, but personally. After the surgery, my mom was a bit fussy with food and didn’t enjoy the meals we were finding in Singapore. Dr. Kon went out of his way to look up Sri Lankan food options himself — something no one would expect from a busy surgeon. It was such a kind and thoughtful gesture, and it meant the world to us.

He and his assistant made us feel like we were at home, even though we were far from it. We are truly grateful for everything he did. Dr. Kon is not only an outstanding doctor but a genuinely kind-hearted human being. We’ll never forget the care and comfort he gave our family during such a difficult time.",https://www.google.com/maps/search/?api=1&query=Mount%20Elizabeth%20Hospital&query_place_id=ChIJnUpJWpIZ2jERhpsQCRE_2-M,FALSE,FALSE,"Dear Sonali Liyanarachchi,

Thank you for your kind words of Dr. Nicolas Kon and team.
We’ll be sure to pass your message along to them.
We’re glad to have been part of your mom's care. 
Wishing your mom and your family continued good health.",Private hospital,0,5,,not spam,good
Mount Elizabeth Hospital,"Hello,
I was hospitalized at Mount Elizabeth Hospital in Singapore from April 4, 2025, to April 16, 2025, due to a sickle cell crisis that occurred during my stay.
I received excellent care and appropriate treatment from the medical staff, and I sincerely thank Dr. Tan Hua Chan Patrick for his attentiveness.
I underwent a blood transfusion, and everything went well. Dr. Tan Hua Chye Patrick reassured me greatly.
I sincerely thank the healthcare staff, cleaning personnel, servers, nurses, aides, doctors, and physiotherapists for their kindness and generosity!
Their warmth and smiles made me forget that I was ill.

Even the dishes were appetizing !

I was able to return to France in good health after my hospitalization.

Thank you all!",https://www.google.com/maps/search/?api=1&query=Mount%20Elizabeth%20Hospital&query_place_id=ChIJnUpJWpIZ2jERhpsQCRE_2-M,FALSE,FALSE,"Dear Déborah, thank you for your kind words about our doctor and healthcare team. We're glad to have supported you in your care and wish you continued good health.",Private hospital,0,5,,not spam,good
Hotel Boss,"We stayed in a triple room for a couple of nights. Small rooms, but well thought out and laid out. The pool is large and very usable, the only issue is that there is 1 Shower for post and changing is an issue. Service is swift and efficient, with both check in and out being a breeze. Location is excellent, close to lavender mrt, lots of dining options nearby.
Overall a very comfortable hotel to stay for a few days",https://www.google.com/maps/search/?api=1&query=Hotel%20Boss&query_place_id=ChIJYakjWbYZ2jERgSiDZRBS8OY,FALSE,TRUE,"Dear Mihir,

Thank you so much for your detailed and thoughtful review!

We’re delighted to hear that you and your family had a comfortable stay and appreciated the thoughtful room layout, smooth check-in and check-out and our convenient location near Lavender MRT. It's great to know you also enjoyed the nearby food options and walkability of the area.

Regarding your feedback about the pool area — thank you for pointing that out. We’d like to share that there is a changing room located on the 4th floor near the children’s playground, which is available for guest use.

We truly value your comments and hope to welcome you back again on your next trip to Singapore!

Warm regards,
Hidayah
Hotel Boss Team",Hotel,0,5,,not spam,good
Hotel Boss,"Wonderful hotel with beautiful open view.
Bus and train are close by, pool is very big.
Gym could be better... hair dryer could had a longer wire as it's connected to the drawer. The bed was okay. Price was fair.
A big thank you for receptionist name Qadir, he chose for me the best view ever and in a quiet area.",https://www.google.com/maps/search/?api=1&query=Hotel%20Boss&query_place_id=ChIJYakjWbYZ2jERgSiDZRBS8OY,FALSE,TRUE,"Dear Inbar Eisenman,

Thank you so much for your wonderful review and for highlighting your experience with us!

We’re thrilled to hear you enjoyed the beautiful open view, spacious pool, and convenient location near public transport. Your feedback about the gym and hair dryer is appreciated, and we will certainly look into improvements.

We’ll be sure to pass on your kind words to Qadir—he’ll be delighted to know he made your stay special with the perfect room choice.

Thanks again for choosing Hotel Boss, and we hope to welcome you back on your next visit!

Warm regards,
Hidayah
Hotel Boss Team
",Hotel,0,5,,not spam,good
Lavender MRT Station (EW11),"Went there to take the bus for Kuala Lumpur. It's close to the hotel boss and it's a busy place. There are a few shops and restaurants there to do some window shopping or to have a quick bite. As we were waiting for the bus but unfortunately there was no such seating arrangements for the passengers. Our waiting time was more than 40 minutes, and we enjoyed the surroundings.",https://www.google.com/maps/search/?api=1&query=Lavender%20MRT%20Station%20(EW11)&query_place_id=ChIJm34e8bUZ2jERrWo7aOBwxhk,FALSE,TRUE,,Transportation service,0,5,,not spam,good
Lavender MRT Station (EW11),"Singapore has an excellent public transport system and good connectivity. However, I still wonder why I could not find rubbish bins on the train or at the station.",https://www.google.com/maps/search/?api=1&query=Lavender%20MRT%20Station%20(EW11)&query_place_id=ChIJm34e8bUZ2jERrWo7aOBwxhk,FALSE,TRUE,,Transportation service,0,5,,not spam,good
Aperia Mall,Revisit Aperia Mall today and the vibes totally diff. Now have many foods&cafe/leisure/activities(National Day)/Thai super market/share workplace(the workshop)/clinic/lifestyle shops. Good job CapitalLand!,https://www.google.com/maps/search/?api=1&query=Aperia%20Mall&query_place_id=ChIJFx0yu8sZ2jERgoVtEwS7Igs,FALSE,TRUE,,Shopping mall,0,5,,not spam,good
Aperia Mall,"Expect lots of activities from this mall especially on every Sunday 11am-6pm. The event is known as: The luggage market where sellers will literally turn out with their luggage’s and pile all used clothing for sale. It’s like a Flea market.  Those used clothing is selling at the price of between $2-$5 and some of the clothing are still in good condition. Besides this luggage market even, 2 main anchor tenants are there too. 1 NTUC as well as a Thailand super market. Head towards the Thai mart and you will find the famous fried banana ball, sweet potato stall there. Pls give it a try, it’s a must try treat. Pls see photo attached",https://www.google.com/maps/search/?api=1&query=Aperia%20Mall&query_place_id=ChIJFx0yu8sZ2jERgoVtEwS7Igs,FALSE,TRUE,,Shopping mall,0,5,,not spam,good
City Square Mall,"The newly renovated City Square Mall is like a ""perfect"" shopping mall. A wide variety of F&B, learning centers, family activties, cinema , entertainments, supermarket, fashion outlets, IT stores, furniture stores, exhibition area, etc. The top floor with super high ceiling provides that super spacious dinning experience. It is a fun place to hangout and enjoy, especially for family to enjoy a weekend of fun and entertainment.",https://www.google.com/maps/search/?api=1&query=City%20Square%20Mall&query_place_id=ChIJZ1omp8gZ2jERgDUAb_hBKLY,FALSE,TRUE,,Shopping mall,0,5,,not spam,good
City Square Mall,"Stayed at the Novotel Hotel which was just opposite of the mall and thus spent lots of time hanging around. I must say that this is one of my favourite malls as there's just everything that you might need from supermarkets, electronics, sport outlets, very interesting restaurants and fast food chains like McDonalds & KFC. It's quite practical for many foreigners as there's also lots of ATM Cash Machines and Currency Exchange facilities on the lower floors.",https://www.google.com/maps/search/?api=1&query=City%20Square%20Mall&query_place_id=ChIJZ1omp8gZ2jERgDUAb_hBKLY,FALSE,TRUE,,Shopping mall,0,5,,not spam,good
Farrer Park MRT Station (NE8),"Farrer Park MRT station is a great and convenient station. It's connected to City Square Mall and One Farrer Hotel, so you can easily access shops, restaurants, and medical services without going outside. The station is clean and easy to navigate, with clear signs and good accessibility for everyone. It's also a perfect starting point to explore the lively Little India area and find great food. Overall, it's a very useful and well-located station.",https://www.google.com/maps/search/?api=1&query=Farrer%20Park%20MRT%20Station%20(NE8)&query_place_id=ChIJm18xEMYZ2jER-3GTUW917eI,FALSE,TRUE,,Suburban train line,0,5,,not spam,good
Farrer Park MRT Station (NE8),MRT station near Serangoon road with connections to all other places at Singapore.,https://www.google.com/maps/search/?api=1&query=Farrer%20Park%20MRT%20Station%20(NE8)&query_place_id=ChIJm18xEMYZ2jER-3GTUW917eI,FALSE,TRUE,,Suburban train line,0,5,,not spam,good
